[sudo] password for sdn: 
tcpdump: verbose output suppressed, use -v or -vv for full protocol decode
listening on any, link-type LINUX_SLL (Linux cooked), capture size 262144 bytes
15:44:45.566859 IP 192.168.100.11.36980 > 10.20.30.2.6653: Flags [S], seq 606496951, win 29200, options [mss 1460,sackOK,TS val 4294954797 ecr 0,nop,wscale 7], length 0
15:44:53.566318 IP 192.168.100.11.36982 > 10.20.30.2.6653: Flags [S], seq 4031048083, win 29200, options [mss 1460,sackOK,TS val 4294956797 ecr 0,nop,wscale 7], length 0
15:45:01.384778 IP 192.168.100.11.37000 > 10.20.30.2.6653: Flags [S], seq 1813325035, win 29200, options [mss 1460,sackOK,TS val 4294958750 ecr 0,nop,wscale 9], length 0
15:45:01.571171 IP 192.168.100.11.37002 > 10.20.30.2.6653: Flags [S], seq 1845247404, win 29200, options [mss 1460,sackOK,TS val 4294958797 ecr 0,nop,wscale 9], length 0
15:45:03.576363 IP 192.168.100.11.37004 > 10.20.30.2.6653: Flags [S], seq 932691714, win 29200, options [mss 1460,sackOK,TS val 4294959297 ecr 0,nop,wscale 9], length 0
15:45:07.565834 IP 192.168.100.11.37006 > 10.20.30.2.6653: Flags [S], seq 3200115855, win 29200, options [mss 1460,sackOK,TS val 4294960297 ecr 0,nop,wscale 9], length 0
