[sudo] password for sdn: 
tcpdump: verbose output suppressed, use -v or -vv for full protocol decode
listening on any, link-type LINUX_SLL (Linux cooked), capture size 262144 bytes
15:44:45.566859 IP 192.168.100.11.36980 > 10.20.30.2.6653: Flags [S], seq 606496951, win 29200, options [mss 1460,sackOK,TS val 4294954797 ecr 0,nop,wscale 7], length 0
15:44:53.566318 IP 192.168.100.11.36982 > 10.20.30.2.6653: Flags [S], seq 4031048083, win 29200, options [mss 1460,sackOK,TS val 4294956797 ecr 0,nop,wscale 7], length 0
15:45:01.384778 IP 192.168.100.11.37000 > 10.20.30.2.6653: Flags [S], seq 1813325035, win 29200, options [mss 1460,sackOK,TS val 4294958750 ecr 0,nop,wscale 9], length 0
15:45:01.571171 IP 192.168.100.11.37002 > 10.20.30.2.6653: Flags [S], seq 1845247404, win 29200, options [mss 1460,sackOK,TS val 4294958797 ecr 0,nop,wscale 9], length 0
15:45:03.576363 IP 192.168.100.11.37004 > 10.20.30.2.6653: Flags [S], seq 932691714, win 29200, options [mss 1460,sackOK,TS val 4294959297 ecr 0,nop,wscale 9], length 0
15:45:07.565834 IP 192.168.100.11.37006 > 10.20.30.2.6653: Flags [S], seq 3200115855, win 29200, options [mss 1460,sackOK,TS val 4294960297 ecr 0,nop,wscale 9], length 0
15:45:15.573142 IP 192.168.100.11.37008 > 10.20.30.2.6653: Flags [S], seq 414319713, win 29200, options [mss 1460,sackOK,TS val 4294962297 ecr 0,nop,wscale 9], length 0
15:45:23.576655 IP 192.168.100.11.37010 > 10.20.30.2.6653: Flags [S], seq 3571804156, win 29200, options [mss 1460,sackOK,TS val 4294964298 ecr 0,nop,wscale 9], length 0
15:45:31.574369 IP 192.168.100.11.37012 > 10.20.30.2.6653: Flags [S], seq 3909469311, win 29200, options [mss 1460,sackOK,TS val 4294966297 ecr 0,nop,wscale 9], length 0
15:45:39.573600 IP 192.168.100.11.37014 > 10.20.30.2.6653: Flags [S], seq 3415104981, win 29200, options [mss 1460,sackOK,TS val 1001 ecr 0,nop,wscale 9], length 0
15:45:47.568909 IP 192.168.100.11.37016 > 10.20.30.2.6653: Flags [S], seq 1714851486, win 29200, options [mss 1460,sackOK,TS val 3001 ecr 0,nop,wscale 9], length 0
15:45:55.599405 IP 192.168.100.11.37018 > 10.20.30.2.6653: Flags [S], seq 2370236287, win 29200, options [mss 1460,sackOK,TS val 5004 ecr 0,nop,wscale 9], length 0
15:46:03.577597 IP 192.168.100.11.37020 > 10.20.30.2.6653: Flags [S], seq 728398209, win 29200, options [mss 1460,sackOK,TS val 7002 ecr 0,nop,wscale 9], length 0
15:46:03.669832 IP 192.168.100.11.37020 > 10.20.30.2.6653: Flags [.], ack 1136580660, win 58, options [nop,nop,TS val 7024 ecr 69692], length 0
15:46:03.693016 IP 192.168.100.11.37020 > 10.20.30.2.6653: Flags [P.], seq 0:16, ack 1, win 58, options [nop,nop,TS val 7024 ecr 69692], length 16: OpenFlow
	version unknown (0x04), type 0x00, length 16, xid 0x00000008
15:46:03.758891 IP 192.168.100.11.37020 > 10.20.30.2.6653: Flags [.], ack 9, win 58, options [nop,nop,TS val 7047 ecr 69718], length 0
15:46:03.789130 IP 192.168.100.11.37020 > 10.20.30.2.6653: Flags [.], ack 17, win 58, options [nop,nop,TS val 7054 ecr 69723], length 0
15:46:03.821129 IP 192.168.100.11.37020 > 10.20.30.2.6653: Flags [P.], seq 16:48, ack 17, win 58, options [nop,nop,TS val 7054 ecr 69723], length 32: OpenFlow
	version unknown (0x04), type 0x06, length 32, xid 0xf50b35a8
15:46:03.913013 IP 192.168.100.11.37020 > 10.20.30.2.6653: Flags [P.], seq 48:256, ack 33, win 58, options [nop,nop,TS val 7086 ecr 69755], length 208: OpenFlow
	version unknown (0x04), type 0x13, length 208, xid 0xf50b35a9
15:46:03.960034 IP 192.168.100.11.37020 > 10.20.30.2.6653: Flags [.], ack 113, win 58, options [nop,nop,TS val 7100 ecr 69755], length 0
15:46:08.566444 IP 192.168.100.11.37020 > 10.20.30.2.6653: Flags [P.], seq 256:264, ack 113, win 58, options [nop,nop,TS val 8251 ecr 69786], length 8: OpenFlow
	version unknown (0x04), type 0x02, length 8, xid 0x00000000
15:46:08.672644 IP 192.168.100.11.37020 > 10.20.30.2.6653: Flags [.], ack 121, win 58, options [nop,nop,TS val 8275 ecr 70940], length 0
15:46:13.584889 IP 192.168.100.11.37020 > 10.20.30.2.6653: Flags [P.], seq 264:272, ack 121, win 58, options [nop,nop,TS val 9501 ecr 70940], length 8: OpenFlow
	version unknown (0x04), type 0x02, length 8, xid 0x00000000
15:46:13.671237 IP 192.168.100.11.37020 > 10.20.30.2.6653: Flags [.], ack 129, win 58, options [nop,nop,TS val 9524 ecr 72194], length 0
15:46:18.586444 IP 192.168.100.11.37020 > 10.20.30.2.6653: Flags [P.], seq 272:280, ack 129, win 58, options [nop,nop,TS val 10753 ecr 72194], length 8: OpenFlow
	version unknown (0x04), type 0x02, length 8, xid 0x00000000
15:46:18.680508 IP 192.168.100.11.37020 > 10.20.30.2.6653: Flags [.], ack 137, win 58, options [nop,nop,TS val 10776 ecr 73445], length 0
15:46:23.608476 IP 192.168.100.11.37020 > 10.20.30.2.6653: Flags [P.], seq 280:288, ack 137, win 58, options [nop,nop,TS val 12001 ecr 73445], length 8: OpenFlow
	version unknown (0x04), type 0x02, length 8, xid 0x00000000
15:46:23.699610 IP 192.168.100.11.37020 > 10.20.30.2.6653: Flags [.], ack 145, win 58, options [nop,nop,TS val 12031 ecr 74700], length 0
15:46:28.569920 IP 192.168.100.11.37020 > 10.20.30.2.6653: Flags [P.], seq 288:296, ack 145, win 58, options [nop,nop,TS val 13251 ecr 74700], length 8: OpenFlow
	version unknown (0x04), type 0x02, length 8, xid 0x00000000
15:46:28.663592 IP 192.168.100.11.37020 > 10.20.30.2.6653: Flags [.], ack 153, win 58, options [nop,nop,TS val 13272 ecr 75940], length 0
15:46:33.566063 IP 192.168.100.11.37020 > 10.20.30.2.6653: Flags [P.], seq 296:304, ack 153, win 58, options [nop,nop,TS val 14501 ecr 75940], length 8: OpenFlow
	version unknown (0x04), type 0x02, length 8, xid 0x00000000
15:46:33.659895 IP 192.168.100.11.37020 > 10.20.30.2.6653: Flags [.], ack 161, win 58, options [nop,nop,TS val 14521 ecr 77190], length 0
15:46:38.578839 IP 192.168.100.11.37020 > 10.20.30.2.6653: Flags [P.], seq 304:312, ack 161, win 58, options [nop,nop,TS val 15751 ecr 77190], length 8: OpenFlow
	version unknown (0x04), type 0x02, length 8, xid 0x00000000
15:46:38.672335 IP 192.168.100.11.37020 > 10.20.30.2.6653: Flags [.], ack 169, win 58, options [nop,nop,TS val 15777 ecr 78443], length 0
15:46:43.575095 IP 192.168.100.11.37020 > 10.20.30.2.6653: Flags [P.], seq 312:320, ack 169, win 58, options [nop,nop,TS val 17001 ecr 78443], length 8: OpenFlow
	version unknown (0x04), type 0x02, length 8, xid 0x00000000
15:46:43.669070 IP 192.168.100.11.37020 > 10.20.30.2.6653: Flags [.], ack 177, win 58, options [nop,nop,TS val 17023 ecr 79692], length 0
15:46:48.573311 IP 192.168.100.11.37020 > 10.20.30.2.6653: Flags [P.], seq 320:328, ack 177, win 58, options [nop,nop,TS val 18251 ecr 79692], length 8: OpenFlow
	version unknown (0x04), type 0x02, length 8, xid 0x00000000
15:46:48.662262 IP 192.168.100.11.37020 > 10.20.30.2.6653: Flags [.], ack 185, win 58, options [nop,nop,TS val 18272 ecr 80942], length 0
15:46:53.575657 IP 192.168.100.11.37020 > 10.20.30.2.6653: Flags [P.], seq 328:336, ack 185, win 58, options [nop,nop,TS val 19501 ecr 80942], length 8: OpenFlow
	version unknown (0x04), type 0x02, length 8, xid 0x00000000
15:46:53.665955 IP 192.168.100.11.37020 > 10.20.30.2.6653: Flags [.], ack 193, win 58, options [nop,nop,TS val 19523 ecr 82192], length 0
15:46:58.569235 IP 192.168.100.11.37020 > 10.20.30.2.6653: Flags [P.], seq 336:344, ack 193, win 58, options [nop,nop,TS val 20751 ecr 82192], length 8: OpenFlow
	version unknown (0x04), type 0x02, length 8, xid 0x00000000
15:46:58.659658 IP 192.168.100.11.37020 > 10.20.30.2.6653: Flags [.], ack 201, win 58, options [nop,nop,TS val 20772 ecr 83440], length 0
15:47:03.577617 IP 192.168.100.11.37020 > 10.20.30.2.6653: Flags [P.], seq 344:352, ack 201, win 58, options [nop,nop,TS val 22001 ecr 83440], length 8: OpenFlow
	version unknown (0x04), type 0x02, length 8, xid 0x00000000
15:47:03.700373 IP 192.168.100.11.37020 > 10.20.30.2.6653: Flags [.], ack 209, win 58, options [nop,nop,TS val 22032 ecr 84694], length 0
15:47:08.573229 IP 192.168.100.11.37020 > 10.20.30.2.6653: Flags [P.], seq 352:360, ack 209, win 58, options [nop,nop,TS val 23251 ecr 84694], length 8: OpenFlow
	version unknown (0x04), type 0x02, length 8, xid 0x00000000
15:47:08.666540 IP 192.168.100.11.37020 > 10.20.30.2.6653: Flags [.], ack 217, win 58, options [nop,nop,TS val 23273 ecr 85941], length 0
15:47:13.573580 IP 192.168.100.11.37020 > 10.20.30.2.6653: Flags [P.], seq 360:368, ack 217, win 58, options [nop,nop,TS val 24501 ecr 85941], length 8: OpenFlow
	version unknown (0x04), type 0x02, length 8, xid 0x00000000
15:47:13.663520 IP 192.168.100.11.37020 > 10.20.30.2.6653: Flags [.], ack 225, win 58, options [nop,nop,TS val 24523 ecr 87192], length 0
15:47:18.567018 IP 192.168.100.11.37020 > 10.20.30.2.6653: Flags [P.], seq 368:376, ack 225, win 58, options [nop,nop,TS val 25751 ecr 87192], length 8: OpenFlow
	version unknown (0x04), type 0x02, length 8, xid 0x00000000
15:47:18.657160 IP 192.168.100.11.37020 > 10.20.30.2.6653: Flags [.], ack 233, win 58, options [nop,nop,TS val 25771 ecr 88441], length 0
15:47:23.567559 IP 192.168.100.11.37020 > 10.20.30.2.6653: Flags [P.], seq 376:384, ack 233, win 58, options [nop,nop,TS val 27001 ecr 88441], length 8: OpenFlow
	version unknown (0x04), type 0x02, length 8, xid 0x00000000
15:47:23.660320 IP 192.168.100.11.37020 > 10.20.30.2.6653: Flags [.], ack 241, win 58, options [nop,nop,TS val 27022 ecr 89690], length 0
15:47:28.566236 IP 192.168.100.11.37020 > 10.20.30.2.6653: Flags [P.], seq 384:392, ack 241, win 58, options [nop,nop,TS val 28251 ecr 89690], length 8: OpenFlow
	version unknown (0x04), type 0x02, length 8, xid 0x00000000
15:47:28.659872 IP 192.168.100.11.37020 > 10.20.30.2.6653: Flags [.], ack 249, win 58, options [nop,nop,TS val 28271 ecr 90939], length 0
15:47:33.576895 IP 192.168.100.11.37020 > 10.20.30.2.6653: Flags [P.], seq 392:400, ack 249, win 58, options [nop,nop,TS val 29501 ecr 90939], length 8: OpenFlow
	version unknown (0x04), type 0x02, length 8, xid 0x00000000
15:47:33.665687 IP 192.168.100.11.37020 > 10.20.30.2.6653: Flags [.], ack 257, win 58, options [nop,nop,TS val 29523 ecr 92193], length 0
15:47:38.571398 IP 192.168.100.11.37020 > 10.20.30.2.6653: Flags [P.], seq 400:408, ack 257, win 58, options [nop,nop,TS val 30751 ecr 92193], length 8: OpenFlow
	version unknown (0x04), type 0x02, length 8, xid 0x00000000
15:47:38.663094 IP 192.168.100.11.37020 > 10.20.30.2.6653: Flags [.], ack 265, win 58, options [nop,nop,TS val 30772 ecr 93441], length 0
15:47:43.572949 IP 192.168.100.11.37020 > 10.20.30.2.6653: Flags [P.], seq 408:416, ack 265, win 58, options [nop,nop,TS val 32001 ecr 93441], length 8: OpenFlow
	version unknown (0x04), type 0x02, length 8, xid 0x00000000
15:47:43.669684 IP 192.168.100.11.37020 > 10.20.30.2.6653: Flags [.], ack 273, win 58, options [nop,nop,TS val 32024 ecr 94691], length 0
15:47:48.572839 IP 192.168.100.11.37020 > 10.20.30.2.6653: Flags [P.], seq 416:424, ack 273, win 58, options [nop,nop,TS val 33251 ecr 94691], length 8: OpenFlow
	version unknown (0x04), type 0x02, length 8, xid 0x00000000
15:47:48.665508 IP 192.168.100.11.37020 > 10.20.30.2.6653: Flags [.], ack 281, win 58, options [nop,nop,TS val 33273 ecr 95941], length 0
15:47:53.564220 IP 192.168.100.11.37020 > 10.20.30.2.6653: Flags [P.], seq 424:432, ack 281, win 58, options [nop,nop,TS val 34501 ecr 95941], length 8: OpenFlow
	version unknown (0x04), type 0x02, length 8, xid 0x00000000
15:47:53.661607 IP 192.168.100.11.37020 > 10.20.30.2.6653: Flags [.], ack 289, win 58, options [nop,nop,TS val 34521 ecr 97189], length 0
15:47:58.593699 IP 192.168.100.11.37020 > 10.20.30.2.6653: Flags [P.], seq 432:440, ack 289, win 58, options [nop,nop,TS val 35751 ecr 97189], length 8: OpenFlow
	version unknown (0x04), type 0x02, length 8, xid 0x00000000
15:47:58.681532 IP 192.168.100.11.37020 > 10.20.30.2.6653: Flags [.], ack 297, win 58, options [nop,nop,TS val 35777 ecr 98447], length 0
15:48:03.578578 IP 192.168.100.11.37020 > 10.20.30.2.6653: Flags [P.], seq 440:448, ack 297, win 58, options [nop,nop,TS val 37001 ecr 98447], length 8: OpenFlow
	version unknown (0x04), type 0x02, length 8, xid 0x00000000
15:48:03.672355 IP 192.168.100.11.37020 > 10.20.30.2.6653: Flags [.], ack 305, win 58, options [nop,nop,TS val 37024 ecr 99692], length 0
15:48:08.576076 IP 192.168.100.11.37020 > 10.20.30.2.6653: Flags [P.], seq 448:456, ack 305, win 58, options [nop,nop,TS val 38251 ecr 99692], length 8: OpenFlow
	version unknown (0x04), type 0x02, length 8, xid 0x00000000
15:48:08.668725 IP 192.168.100.11.37020 > 10.20.30.2.6653: Flags [.], ack 313, win 58, options [nop,nop,TS val 38274 ecr 100943], length 0
15:48:13.571008 IP 192.168.100.11.37020 > 10.20.30.2.6653: Flags [P.], seq 456:464, ack 313, win 58, options [nop,nop,TS val 39501 ecr 100943], length 8: OpenFlow
	version unknown (0x04), type 0x02, length 8, xid 0x00000000
15:48:13.661284 IP 192.168.100.11.37020 > 10.20.30.2.6653: Flags [.], ack 321, win 58, options [nop,nop,TS val 39522 ecr 102191], length 0
15:48:18.576121 IP 192.168.100.11.37020 > 10.20.30.2.6653: Flags [P.], seq 464:472, ack 321, win 58, options [nop,nop,TS val 40751 ecr 102191], length 8: OpenFlow
	version unknown (0x04), type 0x02, length 8, xid 0x00000000
15:48:18.669818 IP 192.168.100.11.37020 > 10.20.30.2.6653: Flags [.], ack 329, win 58, options [nop,nop,TS val 40774 ecr 103442], length 0
15:48:23.580345 IP 192.168.100.11.37020 > 10.20.30.2.6653: Flags [P.], seq 472:480, ack 329, win 58, options [nop,nop,TS val 42001 ecr 103442], length 8: OpenFlow
	version unknown (0x04), type 0x02, length 8, xid 0x00000000
15:48:23.671733 IP 192.168.100.11.37020 > 10.20.30.2.6653: Flags [.], ack 337, win 58, options [nop,nop,TS val 42024 ecr 104693], length 0
15:48:28.566296 IP 192.168.100.11.37020 > 10.20.30.2.6653: Flags [P.], seq 480:488, ack 337, win 58, options [nop,nop,TS val 43251 ecr 104693], length 8: OpenFlow
	version unknown (0x04), type 0x02, length 8, xid 0x00000000
15:48:28.659076 IP 192.168.100.11.37020 > 10.20.30.2.6653: Flags [.], ack 345, win 58, options [nop,nop,TS val 43271 ecr 105940], length 0
15:48:33.569233 IP 192.168.100.11.37020 > 10.20.30.2.6653: Flags [P.], seq 488:496, ack 345, win 58, options [nop,nop,TS val 44501 ecr 105940], length 8: OpenFlow
	version unknown (0x04), type 0x02, length 8, xid 0x00000000
15:48:33.674256 IP 192.168.100.11.37020 > 10.20.30.2.6653: Flags [.], ack 353, win 58, options [nop,nop,TS val 44521 ecr 107191], length 0
15:48:38.576938 IP 192.168.100.11.37020 > 10.20.30.2.6653: Flags [P.], seq 496:504, ack 353, win 58, options [nop,nop,TS val 45751 ecr 107191], length 8: OpenFlow
	version unknown (0x04), type 0x02, length 8, xid 0x00000000
15:48:38.670558 IP 192.168.100.11.37020 > 10.20.30.2.6653: Flags [.], ack 361, win 58, options [nop,nop,TS val 45774 ecr 108442], length 0
15:48:43.568260 IP 192.168.100.11.37020 > 10.20.30.2.6653: Flags [P.], seq 504:512, ack 361, win 58, options [nop,nop,TS val 47001 ecr 108442], length 8: OpenFlow
	version unknown (0x04), type 0x02, length 8, xid 0x00000000
15:48:43.662508 IP 192.168.100.11.37020 > 10.20.30.2.6653: Flags [.], ack 369, win 58, options [nop,nop,TS val 47022 ecr 109690], length 0
15:48:48.574485 IP 192.168.100.11.37020 > 10.20.30.2.6653: Flags [P.], seq 512:520, ack 369, win 58, options [nop,nop,TS val 48251 ecr 109690], length 8: OpenFlow
	version unknown (0x04), type 0x02, length 8, xid 0x00000000
15:48:48.687989 IP 192.168.100.11.37020 > 10.20.30.2.6653: Flags [.], ack 377, win 58, options [nop,nop,TS val 48273 ecr 110941], length 0
15:48:49.129065 IP 192.168.100.11.37020 > 10.20.30.2.6653: Flags [P.], seq 520:600, ack 377, win 58, options [nop,nop,TS val 48389 ecr 110941], length 80: OpenFlow
	version unknown (0x04), type 0x0c, length 80, xid 0x00000000
15:48:49.144871 IP 192.168.100.11.37020 > 10.20.30.2.6653: Flags [P.], seq 600:760, ack 377, win 58, options [nop,nop,TS val 48389 ecr 110941], length 160: OpenFlow
	version unknown (0x04), type 0x0c, length 80, xid 0x00000000
	version unknown (0x04), type 0x0c, length 80, xid 0x00000000
15:48:53.575884 IP 192.168.100.11.37020 > 10.20.30.2.6653: Flags [P.], seq 760:768, ack 377, win 58, options [nop,nop,TS val 49501 ecr 111084], length 8: OpenFlow
	version unknown (0x04), type 0x02, length 8, xid 0x00000000
15:48:53.668953 IP 192.168.100.11.37020 > 10.20.30.2.6653: Flags [.], ack 385, win 58, options [nop,nop,TS val 49524 ecr 112192], length 0
15:48:58.573630 IP 192.168.100.11.37020 > 10.20.30.2.6653: Flags [P.], seq 768:776, ack 385, win 58, options [nop,nop,TS val 50751 ecr 112192], length 8: OpenFlow
	version unknown (0x04), type 0x02, length 8, xid 0x00000000
15:48:58.666168 IP 192.168.100.11.37020 > 10.20.30.2.6653: Flags [.], ack 393, win 58, options [nop,nop,TS val 50773 ecr 113442], length 0
15:49:03.566143 IP 192.168.100.11.37020 > 10.20.30.2.6653: Flags [P.], seq 776:784, ack 393, win 58, options [nop,nop,TS val 52001 ecr 113442], length 8: OpenFlow
	version unknown (0x04), type 0x02, length 8, xid 0x00000000
15:49:03.659491 IP 192.168.100.11.37020 > 10.20.30.2.6653: Flags [.], ack 401, win 58, options [nop,nop,TS val 52021 ecr 114689], length 0
15:49:08.580002 IP 192.168.100.11.37020 > 10.20.30.2.6653: Flags [P.], seq 784:792, ack 401, win 58, options [nop,nop,TS val 53251 ecr 114689], length 8: OpenFlow
	version unknown (0x04), type 0x02, length 8, xid 0x00000000
15:49:08.669129 IP 192.168.100.11.37020 > 10.20.30.2.6653: Flags [.], ack 409, win 58, options [nop,nop,TS val 53273 ecr 115943], length 0
15:49:13.577360 IP 192.168.100.11.37020 > 10.20.30.2.6653: Flags [P.], seq 792:800, ack 409, win 58, options [nop,nop,TS val 54501 ecr 115943], length 8: OpenFlow
	version unknown (0x04), type 0x02, length 8, xid 0x00000000
15:49:13.669742 IP 192.168.100.11.37020 > 10.20.30.2.6653: Flags [.], ack 417, win 58, options [nop,nop,TS val 54524 ecr 117192], length 0
15:49:18.573391 IP 192.168.100.11.37020 > 10.20.30.2.6653: Flags [P.], seq 800:808, ack 417, win 58, options [nop,nop,TS val 55751 ecr 117192], length 8: OpenFlow
	version unknown (0x04), type 0x02, length 8, xid 0x00000000
15:49:18.667983 IP 192.168.100.11.37020 > 10.20.30.2.6653: Flags [.], ack 425, win 58, options [nop,nop,TS val 55773 ecr 118441], length 0
15:49:23.578291 IP 192.168.100.11.37020 > 10.20.30.2.6653: Flags [P.], seq 808:816, ack 425, win 58, options [nop,nop,TS val 57001 ecr 118441], length 8: OpenFlow
	version unknown (0x04), type 0x02, length 8, xid 0x00000000
15:49:23.671435 IP 192.168.100.11.37020 > 10.20.30.2.6653: Flags [.], ack 433, win 58, options [nop,nop,TS val 57024 ecr 119692], length 0
15:49:28.572340 IP 192.168.100.11.37020 > 10.20.30.2.6653: Flags [P.], seq 816:824, ack 433, win 58, options [nop,nop,TS val 58251 ecr 119692], length 8: OpenFlow
	version unknown (0x04), type 0x02, length 8, xid 0x00000000
15:49:28.666966 IP 192.168.100.11.37020 > 10.20.30.2.6653: Flags [.], ack 441, win 58, options [nop,nop,TS val 58273 ecr 120941], length 0
15:49:33.581378 IP 192.168.100.11.37020 > 10.20.30.2.6653: Flags [P.], seq 824:832, ack 441, win 58, options [nop,nop,TS val 59501 ecr 120941], length 8: OpenFlow
	version unknown (0x04), type 0x02, length 8, xid 0x00000000
15:49:33.671702 IP 192.168.100.11.37020 > 10.20.30.2.6653: Flags [.], ack 449, win 58, options [nop,nop,TS val 59524 ecr 122194], length 0
15:49:38.579651 IP 192.168.100.11.37020 > 10.20.30.2.6653: Flags [P.], seq 832:840, ack 449, win 58, options [nop,nop,TS val 60751 ecr 122194], length 8: OpenFlow
	version unknown (0x04), type 0x02, length 8, xid 0x00000000
15:49:38.671995 IP 192.168.100.11.37020 > 10.20.30.2.6653: Flags [.], ack 457, win 58, options [nop,nop,TS val 60775 ecr 123444], length 0
15:49:43.574443 IP 192.168.100.11.37020 > 10.20.30.2.6653: Flags [P.], seq 840:848, ack 457, win 58, options [nop,nop,TS val 62001 ecr 123444], length 8: OpenFlow
	version unknown (0x04), type 0x02, length 8, xid 0x00000000
15:49:43.666674 IP 192.168.100.11.37020 > 10.20.30.2.6653: Flags [.], ack 465, win 58, options [nop,nop,TS val 62024 ecr 124691], length 0
15:49:48.569349 IP 192.168.100.11.37020 > 10.20.30.2.6653: Flags [P.], seq 848:856, ack 465, win 58, options [nop,nop,TS val 63251 ecr 124691], length 8: OpenFlow
	version unknown (0x04), type 0x02, length 8, xid 0x00000000
15:49:48.659381 IP 192.168.100.11.37020 > 10.20.30.2.6653: Flags [.], ack 473, win 58, options [nop,nop,TS val 63271 ecr 125941], length 0
15:49:53.565670 IP 192.168.100.11.37020 > 10.20.30.2.6653: Flags [P.], seq 856:864, ack 473, win 58, options [nop,nop,TS val 64501 ecr 125941], length 8: OpenFlow
	version unknown (0x04), type 0x02, length 8, xid 0x00000000
15:49:53.657358 IP 192.168.100.11.37020 > 10.20.30.2.6653: Flags [.], ack 481, win 58, options [nop,nop,TS val 64521 ecr 127190], length 0
15:49:58.690760 IP 192.168.100.11.37020 > 10.20.30.2.6653: Flags [P.], seq 864:872, ack 481, win 58, options [nop,nop,TS val 65751 ecr 127190], length 8: OpenFlow
	version unknown (0x04), type 0x02, length 8, xid 0x00000000
15:49:58.836181 IP 192.168.100.11.37020 > 10.20.30.2.6653: Flags [.], ack 489, win 58, options [nop,nop,TS val 65811 ecr 128471], length 0
15:50:03.576906 IP 192.168.100.11.37020 > 10.20.30.2.6653: Flags [P.], seq 872:880, ack 489, win 58, options [nop,nop,TS val 67001 ecr 128471], length 8: OpenFlow
	version unknown (0x04), type 0x02, length 8, xid 0x00000000
15:50:03.671663 IP 192.168.100.11.37020 > 10.20.30.2.6653: Flags [.], ack 497, win 58, options [nop,nop,TS val 67024 ecr 129692], length 0
15:50:08.595820 IP 192.168.100.11.37020 > 10.20.30.2.6653: Flags [P.], seq 880:888, ack 497, win 58, options [nop,nop,TS val 68255 ecr 129692], length 8: OpenFlow
	version unknown (0x04), type 0x02, length 8, xid 0x00000000
15:50:08.825052 IP 192.168.100.11.37020 > 10.20.30.2.6653: Flags [.], ack 505, win 58, options [nop,nop,TS val 68308 ecr 130948], length 0
15:50:13.576244 IP 192.168.100.11.37020 > 10.20.30.2.6653: Flags [P.], seq 888:896, ack 505, win 58, options [nop,nop,TS val 69501 ecr 130948], length 8: OpenFlow
	version unknown (0x04), type 0x02, length 8, xid 0x00000000
15:50:13.671721 IP 192.168.100.11.37020 > 10.20.30.2.6653: Flags [.], ack 513, win 58, options [nop,nop,TS val 69524 ecr 132192], length 0
15:50:18.609114 IP 192.168.100.11.37020 > 10.20.30.2.6653: Flags [P.], seq 896:904, ack 513, win 58, options [nop,nop,TS val 70758 ecr 132192], length 8: OpenFlow
	version unknown (0x04), type 0x02, length 8, xid 0x00000000
15:50:18.701788 IP 192.168.100.11.37020 > 10.20.30.2.6653: Flags [.], ack 521, win 58, options [nop,nop,TS val 70783 ecr 133450], length 0
15:50:23.574529 IP 192.168.100.11.37020 > 10.20.30.2.6653: Flags [P.], seq 904:912, ack 521, win 58, options [nop,nop,TS val 72001 ecr 133450], length 8: OpenFlow
	version unknown (0x04), type 0x02, length 8, xid 0x00000000
15:50:23.662900 IP 192.168.100.11.37020 > 10.20.30.2.6653: Flags [.], ack 529, win 58, options [nop,nop,TS val 72022 ecr 134692], length 0
15:50:28.569153 IP 192.168.100.11.37020 > 10.20.30.2.6653: Flags [P.], seq 912:920, ack 529, win 58, options [nop,nop,TS val 73251 ecr 134692], length 8: OpenFlow
	version unknown (0x04), type 0x02, length 8, xid 0x00000000
15:50:28.662165 IP 192.168.100.11.37020 > 10.20.30.2.6653: Flags [.], ack 537, win 58, options [nop,nop,TS val 73272 ecr 135940], length 0
15:50:33.593447 IP 192.168.100.11.37020 > 10.20.30.2.6653: Flags [P.], seq 920:928, ack 537, win 58, options [nop,nop,TS val 74505 ecr 135940], length 8: OpenFlow
	version unknown (0x04), type 0x02, length 8, xid 0x00000000
15:50:33.700690 IP 192.168.100.11.37020 > 10.20.30.2.6653: Flags [.], ack 545, win 58, options [nop,nop,TS val 74529 ecr 137197], length 0
15:50:38.568712 IP 192.168.100.11.37020 > 10.20.30.2.6653: Flags [P.], seq 928:936, ack 545, win 58, options [nop,nop,TS val 75751 ecr 137197], length 8: OpenFlow
	version unknown (0x04), type 0x02, length 8, xid 0x00000000
15:50:38.661332 IP 192.168.100.11.37020 > 10.20.30.2.6653: Flags [.], ack 553, win 58, options [nop,nop,TS val 75772 ecr 138440], length 0
15:50:43.566313 IP 192.168.100.11.37020 > 10.20.30.2.6653: Flags [P.], seq 936:944, ack 553, win 58, options [nop,nop,TS val 77001 ecr 138440], length 8: OpenFlow
	version unknown (0x04), type 0x02, length 8, xid 0x00000000
15:50:43.676858 IP 192.168.100.11.37020 > 10.20.30.2.6653: Flags [.], ack 561, win 58, options [nop,nop,TS val 77025 ecr 139689], length 0
15:50:48.578811 IP 192.168.100.11.37020 > 10.20.30.2.6653: Flags [P.], seq 944:952, ack 561, win 58, options [nop,nop,TS val 78251 ecr 139689], length 8: OpenFlow
	version unknown (0x04), type 0x02, length 8, xid 0x00000000
15:50:48.671917 IP 192.168.100.11.37020 > 10.20.30.2.6653: Flags [.], ack 569, win 58, options [nop,nop,TS val 78275 ecr 140942], length 0
15:50:53.577023 IP 192.168.100.11.37020 > 10.20.30.2.6653: Flags [P.], seq 952:960, ack 569, win 58, options [nop,nop,TS val 79501 ecr 140942], length 8: OpenFlow
	version unknown (0x04), type 0x02, length 8, xid 0x00000000
15:50:53.669780 IP 192.168.100.11.37020 > 10.20.30.2.6653: Flags [.], ack 577, win 58, options [nop,nop,TS val 79524 ecr 142192], length 0
15:50:58.578279 IP 192.168.100.11.37020 > 10.20.30.2.6653: Flags [P.], seq 960:968, ack 577, win 58, options [nop,nop,TS val 80751 ecr 142192], length 8: OpenFlow
	version unknown (0x04), type 0x02, length 8, xid 0x00000000
15:50:58.672549 IP 192.168.100.11.37020 > 10.20.30.2.6653: Flags [.], ack 585, win 58, options [nop,nop,TS val 80774 ecr 143442], length 0
15:51:03.578173 IP 192.168.100.11.37020 > 10.20.30.2.6653: Flags [P.], seq 968:976, ack 585, win 58, options [nop,nop,TS val 82001 ecr 143442], length 8: OpenFlow
	version unknown (0x04), type 0x02, length 8, xid 0x00000000
15:51:03.684317 IP 192.168.100.11.37020 > 10.20.30.2.6653: Flags [.], ack 593, win 58, options [nop,nop,TS val 82027 ecr 144692], length 0
15:51:08.571263 IP 192.168.100.11.37020 > 10.20.30.2.6653: Flags [P.], seq 976:984, ack 593, win 58, options [nop,nop,TS val 83251 ecr 144692], length 8: OpenFlow
	version unknown (0x04), type 0x02, length 8, xid 0x00000000
15:51:08.667532 IP 192.168.100.11.37020 > 10.20.30.2.6653: Flags [.], ack 601, win 58, options [nop,nop,TS val 83273 ecr 145941], length 0
15:51:13.567669 IP 192.168.100.11.37020 > 10.20.30.2.6653: Flags [P.], seq 984:992, ack 601, win 58, options [nop,nop,TS val 84501 ecr 145941], length 8: OpenFlow
	version unknown (0x04), type 0x02, length 8, xid 0x00000000
15:51:13.659906 IP 192.168.100.11.37020 > 10.20.30.2.6653: Flags [.], ack 609, win 58, options [nop,nop,TS val 84521 ecr 147190], length 0
15:51:18.574962 IP 192.168.100.11.37020 > 10.20.30.2.6653: Flags [P.], seq 992:1000, ack 609, win 58, options [nop,nop,TS val 85751 ecr 147190], length 8: OpenFlow
	version unknown (0x04), type 0x02, length 8, xid 0x00000000
15:51:18.664629 IP 192.168.100.11.37020 > 10.20.30.2.6653: Flags [.], ack 617, win 58, options [nop,nop,TS val 85773 ecr 148442], length 0
15:51:23.570482 IP 192.168.100.11.37020 > 10.20.30.2.6653: Flags [P.], seq 1000:1008, ack 617, win 58, options [nop,nop,TS val 87001 ecr 148442], length 8: OpenFlow
	version unknown (0x04), type 0x02, length 8, xid 0x00000000
15:51:23.661235 IP 192.168.100.11.37020 > 10.20.30.2.6653: Flags [.], ack 625, win 58, options [nop,nop,TS val 87023 ecr 149690], length 0
15:51:28.566322 IP 192.168.100.11.37020 > 10.20.30.2.6653: Flags [P.], seq 1008:1016, ack 625, win 58, options [nop,nop,TS val 88251 ecr 149690], length 8: OpenFlow
	version unknown (0x04), type 0x02, length 8, xid 0x00000000
15:51:28.659240 IP 192.168.100.11.37020 > 10.20.30.2.6653: Flags [.], ack 633, win 58, options [nop,nop,TS val 88272 ecr 150939], length 0
15:51:33.574492 IP 192.168.100.11.37020 > 10.20.30.2.6653: Flags [P.], seq 1016:1024, ack 633, win 58, options [nop,nop,TS val 89501 ecr 150939], length 8: OpenFlow
	version unknown (0x04), type 0x02, length 8, xid 0x00000000
15:51:33.666513 IP 192.168.100.11.37020 > 10.20.30.2.6653: Flags [.], ack 641, win 58, options [nop,nop,TS val 89523 ecr 152191], length 0
15:51:38.577114 IP 192.168.100.11.37020 > 10.20.30.2.6653: Flags [P.], seq 1024:1032, ack 641, win 58, options [nop,nop,TS val 90751 ecr 152191], length 8: OpenFlow
	version unknown (0x04), type 0x02, length 8, xid 0x00000000
15:51:38.669667 IP 192.168.100.11.37020 > 10.20.30.2.6653: Flags [.], ack 649, win 58, options [nop,nop,TS val 90774 ecr 153442], length 0
15:51:43.581566 IP 192.168.100.11.37020 > 10.20.30.2.6653: Flags [P.], seq 1032:1040, ack 649, win 58, options [nop,nop,TS val 92002 ecr 153442], length 8: OpenFlow
	version unknown (0x04), type 0x02, length 8, xid 0x00000000
15:51:43.677807 IP 192.168.100.11.37020 > 10.20.30.2.6653: Flags [.], ack 657, win 58, options [nop,nop,TS val 92028 ecr 154693], length 0
15:51:48.563538 IP 192.168.100.11.37020 > 10.20.30.2.6653: Flags [P.], seq 1040:1048, ack 657, win 58, options [nop,nop,TS val 93251 ecr 154693], length 8: OpenFlow
	version unknown (0x04), type 0x02, length 8, xid 0x00000000
15:51:48.658287 IP 192.168.100.11.37020 > 10.20.30.2.6653: Flags [.], ack 665, win 58, options [nop,nop,TS val 93271 ecr 155939], length 0
15:51:53.583268 IP 192.168.100.11.37020 > 10.20.30.2.6653: Flags [P.], seq 1048:1056, ack 665, win 58, options [nop,nop,TS val 94502 ecr 155939], length 8: OpenFlow
	version unknown (0x04), type 0x02, length 8, xid 0x00000000
15:51:53.673897 IP 192.168.100.11.37020 > 10.20.30.2.6653: Flags [.], ack 673, win 58, options [nop,nop,TS val 94525 ecr 157194], length 0
15:51:58.574999 IP 192.168.100.11.37020 > 10.20.30.2.6653: Flags [P.], seq 1056:1064, ack 673, win 58, options [nop,nop,TS val 95751 ecr 157194], length 8: OpenFlow
	version unknown (0x04), type 0x02, length 8, xid 0x00000000
15:51:58.674585 IP 192.168.100.11.37020 > 10.20.30.2.6653: Flags [.], ack 681, win 58, options [nop,nop,TS val 95773 ecr 158442], length 0
15:52:03.570292 IP 192.168.100.11.37020 > 10.20.30.2.6653: Flags [P.], seq 1064:1072, ack 681, win 58, options [nop,nop,TS val 97001 ecr 158442], length 8: OpenFlow
	version unknown (0x04), type 0x02, length 8, xid 0x00000000
15:52:03.660583 IP 192.168.100.11.37020 > 10.20.30.2.6653: Flags [.], ack 689, win 58, options [nop,nop,TS val 97022 ecr 159691], length 0
15:52:08.572492 IP 192.168.100.11.37020 > 10.20.30.2.6653: Flags [P.], seq 1072:1080, ack 689, win 58, options [nop,nop,TS val 98251 ecr 159691], length 8: OpenFlow
	version unknown (0x04), type 0x02, length 8, xid 0x00000000
15:52:08.663672 IP 192.168.100.11.37020 > 10.20.30.2.6653: Flags [.], ack 697, win 58, options [nop,nop,TS val 98273 ecr 160941], length 0
15:52:13.572223 IP 192.168.100.11.37020 > 10.20.30.2.6653: Flags [P.], seq 1080:1088, ack 697, win 58, options [nop,nop,TS val 99501 ecr 160941], length 8: OpenFlow
	version unknown (0x04), type 0x02, length 8, xid 0x00000000
15:52:13.660224 IP 192.168.100.11.37020 > 10.20.30.2.6653: Flags [.], ack 705, win 58, options [nop,nop,TS val 99523 ecr 162192], length 0
15:52:18.565176 IP 192.168.100.11.37020 > 10.20.30.2.6653: Flags [P.], seq 1088:1096, ack 705, win 58, options [nop,nop,TS val 100751 ecr 162192], length 8: OpenFlow
	version unknown (0x04), type 0x02, length 8, xid 0x00000000
15:52:18.660402 IP 192.168.100.11.37020 > 10.20.30.2.6653: Flags [.], ack 713, win 58, options [nop,nop,TS val 100772 ecr 163439], length 0
15:52:23.603467 IP 192.168.100.11.37020 > 10.20.30.2.6653: Flags [P.], seq 1096:1104, ack 713, win 58, options [nop,nop,TS val 102006 ecr 163439], length 8: OpenFlow
	version unknown (0x04), type 0x02, length 8, xid 0x00000000
15:52:23.697513 IP 192.168.100.11.37020 > 10.20.30.2.6653: Flags [.], ack 721, win 58, options [nop,nop,TS val 102030 ecr 164699], length 0
15:52:28.569262 IP 192.168.100.11.37020 > 10.20.30.2.6653: Flags [P.], seq 1104:1112, ack 721, win 58, options [nop,nop,TS val 103252 ecr 164699], length 8: OpenFlow
	version unknown (0x04), type 0x02, length 8, xid 0x00000000
15:52:28.663824 IP 192.168.100.11.37020 > 10.20.30.2.6653: Flags [.], ack 729, win 58, options [nop,nop,TS val 103272 ecr 165940], length 0
15:52:33.566676 IP 192.168.100.11.37020 > 10.20.30.2.6653: Flags [P.], seq 1112:1120, ack 729, win 58, options [nop,nop,TS val 104501 ecr 165940], length 8: OpenFlow
	version unknown (0x04), type 0x02, length 8, xid 0x00000000
15:52:33.658558 IP 192.168.100.11.37020 > 10.20.30.2.6653: Flags [.], ack 737, win 58, options [nop,nop,TS val 104521 ecr 167190], length 0
15:52:38.565970 IP 192.168.100.11.37020 > 10.20.30.2.6653: Flags [P.], seq 1120:1128, ack 737, win 58, options [nop,nop,TS val 105751 ecr 167190], length 8: OpenFlow
	version unknown (0x04), type 0x02, length 8, xid 0x00000000
15:52:38.657885 IP 192.168.100.11.37020 > 10.20.30.2.6653: Flags [.], ack 745, win 58, options [nop,nop,TS val 105771 ecr 168440], length 0
15:52:43.577023 IP 192.168.100.11.37020 > 10.20.30.2.6653: Flags [P.], seq 1128:1136, ack 745, win 58, options [nop,nop,TS val 107001 ecr 168440], length 8: OpenFlow
	version unknown (0x04), type 0x02, length 8, xid 0x00000000
15:52:43.676603 IP 192.168.100.11.37020 > 10.20.30.2.6653: Flags [.], ack 753, win 58, options [nop,nop,TS val 107026 ecr 169692], length 0
15:52:48.569886 IP 192.168.100.11.37020 > 10.20.30.2.6653: Flags [P.], seq 1136:1144, ack 753, win 58, options [nop,nop,TS val 108251 ecr 169692], length 8: OpenFlow
	version unknown (0x04), type 0x02, length 8, xid 0x00000000
15:52:48.663700 IP 192.168.100.11.37020 > 10.20.30.2.6653: Flags [.], ack 761, win 58, options [nop,nop,TS val 108272 ecr 170940], length 0
15:52:53.580538 IP 192.168.100.11.37020 > 10.20.30.2.6653: Flags [P.], seq 1144:1152, ack 761, win 58, options [nop,nop,TS val 109501 ecr 170940], length 8: OpenFlow
	version unknown (0x04), type 0x02, length 8, xid 0x00000000
15:52:53.668635 IP 192.168.100.11.37020 > 10.20.30.2.6653: Flags [.], ack 769, win 58, options [nop,nop,TS val 109524 ecr 172193], length 0
15:52:58.568618 IP 192.168.100.11.37020 > 10.20.30.2.6653: Flags [P.], seq 1152:1160, ack 769, win 58, options [nop,nop,TS val 110751 ecr 172193], length 8: OpenFlow
	version unknown (0x04), type 0x02, length 8, xid 0x00000000
15:52:58.675627 IP 192.168.100.11.37020 > 10.20.30.2.6653: Flags [.], ack 777, win 58, options [nop,nop,TS val 110776 ecr 173440], length 0
15:53:03.567176 IP 192.168.100.11.37020 > 10.20.30.2.6653: Flags [P.], seq 1160:1168, ack 777, win 58, options [nop,nop,TS val 112001 ecr 173440], length 8: OpenFlow
	version unknown (0x04), type 0x02, length 8, xid 0x00000000
15:53:03.671955 IP 192.168.100.11.37020 > 10.20.30.2.6653: Flags [.], ack 785, win 58, options [nop,nop,TS val 112021 ecr 174690], length 0
15:53:08.574217 IP 192.168.100.11.37020 > 10.20.30.2.6653: Flags [P.], seq 1168:1176, ack 785, win 58, options [nop,nop,TS val 113251 ecr 174690], length 8: OpenFlow
	version unknown (0x04), type 0x02, length 8, xid 0x00000000
15:53:08.666282 IP 192.168.100.11.37020 > 10.20.30.2.6653: Flags [.], ack 793, win 58, options [nop,nop,TS val 113273 ecr 175941], length 0
15:53:13.567044 IP 192.168.100.11.37020 > 10.20.30.2.6653: Flags [P.], seq 1176:1184, ack 793, win 58, options [nop,nop,TS val 114501 ecr 175941], length 8: OpenFlow
	version unknown (0x04), type 0x02, length 8, xid 0x00000000
15:53:13.656987 IP 192.168.100.11.37020 > 10.20.30.2.6653: Flags [.], ack 801, win 58, options [nop,nop,TS val 114522 ecr 177191], length 0
15:53:18.571714 IP 192.168.100.11.37020 > 10.20.30.2.6653: Flags [P.], seq 1184:1192, ack 801, win 58, options [nop,nop,TS val 115751 ecr 177191], length 8: OpenFlow
	version unknown (0x04), type 0x02, length 8, xid 0x00000000
15:53:18.664926 IP 192.168.100.11.37020 > 10.20.30.2.6653: Flags [.], ack 809, win 58, options [nop,nop,TS val 115773 ecr 178441], length 0
15:53:23.568040 IP 192.168.100.11.37020 > 10.20.30.2.6653: Flags [P.], seq 1192:1200, ack 809, win 58, options [nop,nop,TS val 117001 ecr 178441], length 8: OpenFlow
	version unknown (0x04), type 0x02, length 8, xid 0x00000000
15:53:23.659254 IP 192.168.100.11.37020 > 10.20.30.2.6653: Flags [.], ack 817, win 58, options [nop,nop,TS val 117022 ecr 179691], length 0
15:53:28.569982 IP 192.168.100.11.37020 > 10.20.30.2.6653: Flags [P.], seq 1200:1208, ack 817, win 58, options [nop,nop,TS val 118251 ecr 179691], length 8: OpenFlow
	version unknown (0x04), type 0x02, length 8, xid 0x00000000
15:53:28.662725 IP 192.168.100.11.37020 > 10.20.30.2.6653: Flags [.], ack 825, win 58, options [nop,nop,TS val 118272 ecr 180940], length 0
15:53:33.583566 IP 192.168.100.11.37020 > 10.20.30.2.6653: Flags [P.], seq 1208:1216, ack 825, win 58, options [nop,nop,TS val 119503 ecr 180940], length 8: OpenFlow
	version unknown (0x04), type 0x02, length 8, xid 0x00000000
15:53:33.674247 IP 192.168.100.11.37020 > 10.20.30.2.6653: Flags [.], ack 833, win 58, options [nop,nop,TS val 119525 ecr 182194], length 0
15:53:38.570684 IP 192.168.100.11.37020 > 10.20.30.2.6653: Flags [P.], seq 1216:1224, ack 833, win 58, options [nop,nop,TS val 120751 ecr 182194], length 8: OpenFlow
	version unknown (0x04), type 0x02, length 8, xid 0x00000000
15:53:38.662953 IP 192.168.100.11.37020 > 10.20.30.2.6653: Flags [.], ack 841, win 58, options [nop,nop,TS val 120772 ecr 183440], length 0
15:53:43.566591 IP 192.168.100.11.37020 > 10.20.30.2.6653: Flags [P.], seq 1224:1232, ack 841, win 58, options [nop,nop,TS val 122001 ecr 183440], length 8: OpenFlow
	version unknown (0x04), type 0x02, length 8, xid 0x00000000
15:53:43.663730 IP 192.168.100.11.37020 > 10.20.30.2.6653: Flags [.], ack 849, win 58, options [nop,nop,TS val 122021 ecr 184689], length 0
15:53:48.568112 IP 192.168.100.11.37020 > 10.20.30.2.6653: Flags [P.], seq 1232:1240, ack 849, win 58, options [nop,nop,TS val 123251 ecr 184689], length 8: OpenFlow
	version unknown (0x04), type 0x02, length 8, xid 0x00000000
15:53:48.656751 IP 192.168.100.11.37020 > 10.20.30.2.6653: Flags [.], ack 857, win 58, options [nop,nop,TS val 123271 ecr 185940], length 0
15:53:53.578408 IP 192.168.100.11.37020 > 10.20.30.2.6653: Flags [P.], seq 1240:1248, ack 857, win 58, options [nop,nop,TS val 124501 ecr 185940], length 8: OpenFlow
	version unknown (0x04), type 0x02, length 8, xid 0x00000000
15:53:53.684610 IP 192.168.100.11.37020 > 10.20.30.2.6653: Flags [.], ack 865, win 58, options [nop,nop,TS val 124528 ecr 187194], length 0
15:53:58.581483 IP 192.168.100.11.37020 > 10.20.30.2.6653: Flags [P.], seq 1248:1256, ack 865, win 58, options [nop,nop,TS val 125751 ecr 187194], length 8: OpenFlow
	version unknown (0x04), type 0x02, length 8, xid 0x00000000
15:53:58.676971 IP 192.168.100.11.37020 > 10.20.30.2.6653: Flags [.], ack 873, win 58, options [nop,nop,TS val 125776 ecr 188443], length 0
15:54:03.570469 IP 192.168.100.11.37020 > 10.20.30.2.6653: Flags [P.], seq 1256:1264, ack 873, win 58, options [nop,nop,TS val 127001 ecr 188443], length 8: OpenFlow
	version unknown (0x04), type 0x02, length 8, xid 0x00000000
15:54:03.663142 IP 192.168.100.11.37020 > 10.20.30.2.6653: Flags [.], ack 881, win 58, options [nop,nop,TS val 127022 ecr 189691], length 0
15:54:08.573209 IP 192.168.100.11.37020 > 10.20.30.2.6653: Flags [P.], seq 1264:1272, ack 881, win 58, options [nop,nop,TS val 128251 ecr 189691], length 8: OpenFlow
	version unknown (0x04), type 0x02, length 8, xid 0x00000000
15:54:08.665259 IP 192.168.100.11.37020 > 10.20.30.2.6653: Flags [.], ack 889, win 58, options [nop,nop,TS val 128273 ecr 190941], length 0
15:54:13.565466 IP 192.168.100.11.37020 > 10.20.30.2.6653: Flags [P.], seq 1272:1280, ack 889, win 58, options [nop,nop,TS val 129501 ecr 190941], length 8: OpenFlow
	version unknown (0x04), type 0x02, length 8, xid 0x00000000
15:54:13.660750 IP 192.168.100.11.37020 > 10.20.30.2.6653: Flags [.], ack 897, win 58, options [nop,nop,TS val 129522 ecr 192189], length 0
15:54:18.568839 IP 192.168.100.11.37020 > 10.20.30.2.6653: Flags [P.], seq 1280:1288, ack 897, win 58, options [nop,nop,TS val 130751 ecr 192189], length 8: OpenFlow
	version unknown (0x04), type 0x02, length 8, xid 0x00000000
15:54:18.661229 IP 192.168.100.11.37020 > 10.20.30.2.6653: Flags [.], ack 905, win 58, options [nop,nop,TS val 130773 ecr 193440], length 0
15:54:23.571494 IP 192.168.100.11.37020 > 10.20.30.2.6653: Flags [P.], seq 1288:1296, ack 905, win 58, options [nop,nop,TS val 132001 ecr 193440], length 8: OpenFlow
	version unknown (0x04), type 0x02, length 8, xid 0x00000000
15:54:23.663200 IP 192.168.100.11.37020 > 10.20.30.2.6653: Flags [.], ack 913, win 58, options [nop,nop,TS val 132022 ecr 194691], length 0
15:54:28.578129 IP 192.168.100.11.37020 > 10.20.30.2.6653: Flags [P.], seq 1296:1304, ack 913, win 58, options [nop,nop,TS val 133251 ecr 194691], length 8: OpenFlow
	version unknown (0x04), type 0x02, length 8, xid 0x00000000
15:54:28.668690 IP 192.168.100.11.37020 > 10.20.30.2.6653: Flags [.], ack 921, win 58, options [nop,nop,TS val 133274 ecr 195942], length 0
15:54:33.582291 IP 192.168.100.11.37020 > 10.20.30.2.6653: Flags [P.], seq 1304:1312, ack 921, win 58, options [nop,nop,TS val 134505 ecr 195942], length 8: OpenFlow
	version unknown (0x04), type 0x02, length 8, xid 0x00000000
15:54:33.677276 IP 192.168.100.11.37020 > 10.20.30.2.6653: Flags [.], ack 929, win 58, options [nop,nop,TS val 134525 ecr 197193], length 0
15:54:38.576922 IP 192.168.100.11.37020 > 10.20.30.2.6653: Flags [P.], seq 1312:1320, ack 929, win 58, options [nop,nop,TS val 135751 ecr 197193], length 8: OpenFlow
	version unknown (0x04), type 0x02, length 8, xid 0x00000000
15:54:38.669333 IP 192.168.100.11.37020 > 10.20.30.2.6653: Flags [.], ack 937, win 58, options [nop,nop,TS val 135774 ecr 198442], length 0
15:54:43.584182 IP 192.168.100.11.37020 > 10.20.30.2.6653: Flags [P.], seq 1320:1328, ack 937, win 58, options [nop,nop,TS val 137002 ecr 198442], length 8: OpenFlow
	version unknown (0x04), type 0x02, length 8, xid 0x00000000
15:54:43.676632 IP 192.168.100.11.37020 > 10.20.30.2.6653: Flags [.], ack 945, win 58, options [nop,nop,TS val 137026 ecr 199694], length 0
15:54:48.565331 IP 192.168.100.11.37020 > 10.20.30.2.6653: Flags [P.], seq 1328:1336, ack 945, win 58, options [nop,nop,TS val 138251 ecr 199694], length 8: OpenFlow
	version unknown (0x04), type 0x02, length 8, xid 0x00000000
15:54:48.658508 IP 192.168.100.11.37020 > 10.20.30.2.6653: Flags [.], ack 953, win 58, options [nop,nop,TS val 138271 ecr 200939], length 0
15:54:53.575191 IP 192.168.100.11.37020 > 10.20.30.2.6653: Flags [P.], seq 1336:1344, ack 953, win 58, options [nop,nop,TS val 139501 ecr 200939], length 8: OpenFlow
	version unknown (0x04), type 0x02, length 8, xid 0x00000000
15:54:53.667856 IP 192.168.100.11.37020 > 10.20.30.2.6653: Flags [.], ack 961, win 58, options [nop,nop,TS val 139523 ecr 202192], length 0
15:54:58.574526 IP 192.168.100.11.37020 > 10.20.30.2.6653: Flags [P.], seq 1344:1352, ack 961, win 58, options [nop,nop,TS val 140751 ecr 202192], length 8: OpenFlow
	version unknown (0x04), type 0x02, length 8, xid 0x00000000
15:54:58.665443 IP 192.168.100.11.37020 > 10.20.30.2.6653: Flags [.], ack 969, win 58, options [nop,nop,TS val 140774 ecr 203442], length 0
15:55:03.571111 IP 192.168.100.11.37020 > 10.20.30.2.6653: Flags [P.], seq 1352:1360, ack 969, win 58, options [nop,nop,TS val 142001 ecr 203442], length 8: OpenFlow
	version unknown (0x04), type 0x02, length 8, xid 0x00000000
15:55:03.661917 IP 192.168.100.11.37020 > 10.20.30.2.6653: Flags [.], ack 977, win 58, options [nop,nop,TS val 142022 ecr 204692], length 0
15:55:08.577137 IP 192.168.100.11.37020 > 10.20.30.2.6653: Flags [P.], seq 1360:1368, ack 977, win 58, options [nop,nop,TS val 143251 ecr 204692], length 8: OpenFlow
	version unknown (0x04), type 0x02, length 8, xid 0x00000000
15:55:08.670913 IP 192.168.100.11.37020 > 10.20.30.2.6653: Flags [.], ack 985, win 58, options [nop,nop,TS val 143275 ecr 205942], length 0
15:55:13.575132 IP 192.168.100.11.37020 > 10.20.30.2.6653: Flags [P.], seq 1368:1376, ack 985, win 58, options [nop,nop,TS val 144501 ecr 205942], length 8: OpenFlow
	version unknown (0x04), type 0x02, length 8, xid 0x00000000
15:55:13.668491 IP 192.168.100.11.37020 > 10.20.30.2.6653: Flags [.], ack 993, win 58, options [nop,nop,TS val 144524 ecr 207192], length 0
15:55:18.574332 IP 192.168.100.11.37020 > 10.20.30.2.6653: Flags [P.], seq 1376:1384, ack 993, win 58, options [nop,nop,TS val 145751 ecr 207192], length 8: OpenFlow
	version unknown (0x04), type 0x02, length 8, xid 0x00000000
15:55:18.674774 IP 192.168.100.11.37020 > 10.20.30.2.6653: Flags [.], ack 1001, win 58, options [nop,nop,TS val 145776 ecr 208442], length 0
15:55:23.568596 IP 192.168.100.11.37020 > 10.20.30.2.6653: Flags [P.], seq 1384:1392, ack 1001, win 58, options [nop,nop,TS val 147001 ecr 208442], length 8: OpenFlow
	version unknown (0x04), type 0x02, length 8, xid 0x00000000
15:55:23.659706 IP 192.168.100.11.37020 > 10.20.30.2.6653: Flags [.], ack 1009, win 58, options [nop,nop,TS val 147022 ecr 209690], length 0
15:55:28.572084 IP 192.168.100.11.37020 > 10.20.30.2.6653: Flags [P.], seq 1392:1400, ack 1009, win 58, options [nop,nop,TS val 148251 ecr 209690], length 8: OpenFlow
	version unknown (0x04), type 0x02, length 8, xid 0x00000000
15:55:28.659499 IP 192.168.100.11.37020 > 10.20.30.2.6653: Flags [.], ack 1017, win 58, options [nop,nop,TS val 148272 ecr 210942], length 0
15:55:33.579064 IP 192.168.100.11.37020 > 10.20.30.2.6653: Flags [P.], seq 1400:1408, ack 1017, win 58, options [nop,nop,TS val 149501 ecr 210942], length 8: OpenFlow
	version unknown (0x04), type 0x02, length 8, xid 0x00000000
15:55:33.685675 IP 192.168.100.11.37020 > 10.20.30.2.6653: Flags [.], ack 1025, win 58, options [nop,nop,TS val 149528 ecr 212194], length 0
15:55:38.584800 IP 192.168.100.11.37020 > 10.20.30.2.6653: Flags [P.], seq 1408:1416, ack 1025, win 58, options [nop,nop,TS val 150756 ecr 212194], length 8: OpenFlow
	version unknown (0x04), type 0x02, length 8, xid 0x00000000
15:55:38.676312 IP 192.168.100.11.37020 > 10.20.30.2.6653: Flags [.], ack 1033, win 58, options [nop,nop,TS val 150776 ecr 213444], length 0
15:55:43.585759 IP 192.168.100.11.37020 > 10.20.30.2.6653: Flags [P.], seq 1416:1424, ack 1033, win 58, options [nop,nop,TS val 152001 ecr 213444], length 8: OpenFlow
	version unknown (0x04), type 0x02, length 8, xid 0x00000000
15:55:43.697175 IP 192.168.100.11.37020 > 10.20.30.2.6653: Flags [.], ack 1041, win 58, options [nop,nop,TS val 152030 ecr 214697], length 0
15:55:48.568501 IP 192.168.100.11.37020 > 10.20.30.2.6653: Flags [P.], seq 1424:1432, ack 1041, win 58, options [nop,nop,TS val 153251 ecr 214697], length 8: OpenFlow
	version unknown (0x04), type 0x02, length 8, xid 0x00000000
15:55:48.660369 IP 192.168.100.11.37020 > 10.20.30.2.6653: Flags [.], ack 1049, win 58, options [nop,nop,TS val 153272 ecr 215940], length 0
15:55:53.567138 IP 192.168.100.11.37020 > 10.20.30.2.6653: Flags [P.], seq 1432:1440, ack 1049, win 58, options [nop,nop,TS val 154501 ecr 215940], length 8: OpenFlow
	version unknown (0x04), type 0x02, length 8, xid 0x00000000
15:55:53.660052 IP 192.168.100.11.37020 > 10.20.30.2.6653: Flags [.], ack 1057, win 58, options [nop,nop,TS val 154521 ecr 217190], length 0
15:55:58.581331 IP 192.168.100.11.37020 > 10.20.30.2.6653: Flags [P.], seq 1440:1448, ack 1057, win 58, options [nop,nop,TS val 155751 ecr 217190], length 8: OpenFlow
	version unknown (0x04), type 0x02, length 8, xid 0x00000000
15:55:58.674470 IP 192.168.100.11.37020 > 10.20.30.2.6653: Flags [.], ack 1065, win 58, options [nop,nop,TS val 155775 ecr 218443], length 0
15:56:03.568593 IP 192.168.100.11.37020 > 10.20.30.2.6653: Flags [P.], seq 1448:1456, ack 1065, win 58, options [nop,nop,TS val 157001 ecr 218443], length 8: OpenFlow
	version unknown (0x04), type 0x02, length 8, xid 0x00000000
15:56:03.660963 IP 192.168.100.11.37020 > 10.20.30.2.6653: Flags [.], ack 1073, win 58, options [nop,nop,TS val 157022 ecr 219690], length 0
15:56:08.573562 IP 192.168.100.11.37020 > 10.20.30.2.6653: Flags [P.], seq 1456:1464, ack 1073, win 58, options [nop,nop,TS val 158251 ecr 219690], length 8: OpenFlow
	version unknown (0x04), type 0x02, length 8, xid 0x00000000
15:56:08.664788 IP 192.168.100.11.37020 > 10.20.30.2.6653: Flags [.], ack 1081, win 58, options [nop,nop,TS val 158273 ecr 220941], length 0
15:56:13.562428 IP 192.168.100.11.37020 > 10.20.30.2.6653: Flags [P.], seq 1464:1472, ack 1081, win 58, options [nop,nop,TS val 159501 ecr 220941], length 8: OpenFlow
	version unknown (0x04), type 0x02, length 8, xid 0x00000000
15:56:13.656426 IP 192.168.100.11.37020 > 10.20.30.2.6653: Flags [.], ack 1089, win 58, options [nop,nop,TS val 159520 ecr 222188], length 0
15:56:18.586000 IP 192.168.100.11.37020 > 10.20.30.2.6653: Flags [P.], seq 1472:1480, ack 1089, win 58, options [nop,nop,TS val 160752 ecr 222188], length 8: OpenFlow
	version unknown (0x04), type 0x02, length 8, xid 0x00000000
15:56:18.674560 IP 192.168.100.11.37020 > 10.20.30.2.6653: Flags [.], ack 1097, win 58, options [nop,nop,TS val 160776 ecr 223445], length 0
15:56:23.565002 IP 192.168.100.11.37020 > 10.20.30.2.6653: Flags [P.], seq 1480:1488, ack 1097, win 58, options [nop,nop,TS val 162001 ecr 223445], length 8: OpenFlow
	version unknown (0x04), type 0x02, length 8, xid 0x00000000
15:56:23.656942 IP 192.168.100.11.37020 > 10.20.30.2.6653: Flags [.], ack 1105, win 58, options [nop,nop,TS val 162021 ecr 224689], length 0
15:56:28.575623 IP 192.168.100.11.37020 > 10.20.30.2.6653: Flags [P.], seq 1488:1496, ack 1105, win 58, options [nop,nop,TS val 163251 ecr 224689], length 8: OpenFlow
	version unknown (0x04), type 0x02, length 8, xid 0x00000000
15:56:28.666575 IP 192.168.100.11.37020 > 10.20.30.2.6653: Flags [.], ack 1113, win 58, options [nop,nop,TS val 163273 ecr 225943], length 0
15:56:33.566564 IP 192.168.100.11.37020 > 10.20.30.2.6653: Flags [P.], seq 1496:1504, ack 1113, win 58, options [nop,nop,TS val 164501 ecr 225943], length 8: OpenFlow
	version unknown (0x04), type 0x02, length 8, xid 0x00000000
15:56:33.654156 IP 192.168.100.11.37020 > 10.20.30.2.6653: Flags [.], ack 1121, win 58, options [nop,nop,TS val 164521 ecr 227190], length 0
15:56:38.570053 IP 192.168.100.11.37020 > 10.20.30.2.6653: Flags [P.], seq 1504:1512, ack 1121, win 58, options [nop,nop,TS val 165751 ecr 227190], length 8: OpenFlow
	version unknown (0x04), type 0x02, length 8, xid 0x00000000
15:56:38.661158 IP 192.168.100.11.37020 > 10.20.30.2.6653: Flags [.], ack 1129, win 58, options [nop,nop,TS val 165772 ecr 228440], length 0
15:56:43.570280 IP 192.168.100.11.37020 > 10.20.30.2.6653: Flags [P.], seq 1512:1520, ack 1129, win 58, options [nop,nop,TS val 167001 ecr 228440], length 8: OpenFlow
	version unknown (0x04), type 0x02, length 8, xid 0x00000000
15:56:43.659410 IP 192.168.100.11.37020 > 10.20.30.2.6653: Flags [.], ack 1137, win 58, options [nop,nop,TS val 167022 ecr 229690], length 0
15:56:48.576428 IP 192.168.100.11.37020 > 10.20.30.2.6653: Flags [P.], seq 1520:1528, ack 1137, win 58, options [nop,nop,TS val 168251 ecr 229690], length 8: OpenFlow
	version unknown (0x04), type 0x02, length 8, xid 0x00000000
15:56:48.667350 IP 192.168.100.11.37020 > 10.20.30.2.6653: Flags [.], ack 1145, win 58, options [nop,nop,TS val 168273 ecr 230942], length 0
15:56:53.568712 IP 192.168.100.11.37020 > 10.20.30.2.6653: Flags [P.], seq 1528:1536, ack 1145, win 58, options [nop,nop,TS val 169501 ecr 230942], length 8: OpenFlow
	version unknown (0x04), type 0x02, length 8, xid 0x00000000
15:56:53.664450 IP 192.168.100.11.37020 > 10.20.30.2.6653: Flags [.], ack 1153, win 58, options [nop,nop,TS val 169522 ecr 232190], length 0
15:56:58.578966 IP 192.168.100.11.37020 > 10.20.30.2.6653: Flags [P.], seq 1536:1544, ack 1153, win 58, options [nop,nop,TS val 170751 ecr 232190], length 8: OpenFlow
	version unknown (0x04), type 0x02, length 8, xid 0x00000000
15:56:58.670918 IP 192.168.100.11.37020 > 10.20.30.2.6653: Flags [.], ack 1161, win 58, options [nop,nop,TS val 170774 ecr 233442], length 0
15:57:03.596224 IP 192.168.100.11.37020 > 10.20.30.2.6653: Flags [P.], seq 1544:1552, ack 1161, win 58, options [nop,nop,TS val 172004 ecr 233442], length 8: OpenFlow
	version unknown (0x04), type 0x02, length 8, xid 0x00000000
15:57:03.687946 IP 192.168.100.11.37020 > 10.20.30.2.6653: Flags [.], ack 1169, win 58, options [nop,nop,TS val 172028 ecr 234697], length 0
15:57:08.566640 IP 192.168.100.11.37020 > 10.20.30.2.6653: Flags [P.], seq 1552:1560, ack 1169, win 58, options [nop,nop,TS val 173251 ecr 234697], length 8: OpenFlow
	version unknown (0x04), type 0x02, length 8, xid 0x00000000
15:57:08.658772 IP 192.168.100.11.37020 > 10.20.30.2.6653: Flags [.], ack 1177, win 58, options [nop,nop,TS val 173272 ecr 235939], length 0
15:57:13.585051 IP 192.168.100.11.37020 > 10.20.30.2.6653: Flags [P.], seq 1560:1568, ack 1177, win 58, options [nop,nop,TS val 174501 ecr 235939], length 8: OpenFlow
	version unknown (0x04), type 0x02, length 8, xid 0x00000000
15:57:13.675602 IP 192.168.100.11.37020 > 10.20.30.2.6653: Flags [.], ack 1185, win 58, options [nop,nop,TS val 174526 ecr 237194], length 0
15:57:18.581613 IP 192.168.100.11.37020 > 10.20.30.2.6653: Flags [P.], seq 1568:1576, ack 1185, win 58, options [nop,nop,TS val 175751 ecr 237194], length 8: OpenFlow
	version unknown (0x04), type 0x02, length 8, xid 0x00000000
15:57:18.670513 IP 192.168.100.11.37020 > 10.20.30.2.6653: Flags [.], ack 1193, win 58, options [nop,nop,TS val 175775 ecr 238444], length 0
15:57:23.571763 IP 192.168.100.11.37020 > 10.20.30.2.6653: Flags [P.], seq 1576:1584, ack 1193, win 58, options [nop,nop,TS val 177001 ecr 238444], length 8: OpenFlow
	version unknown (0x04), type 0x02, length 8, xid 0x00000000
15:57:23.663910 IP 192.168.100.11.37020 > 10.20.30.2.6653: Flags [.], ack 1201, win 58, options [nop,nop,TS val 177022 ecr 239691], length 0
15:57:28.574034 IP 192.168.100.11.37020 > 10.20.30.2.6653: Flags [P.], seq 1584:1592, ack 1201, win 58, options [nop,nop,TS val 178251 ecr 239691], length 8: OpenFlow
	version unknown (0x04), type 0x02, length 8, xid 0x00000000
15:57:28.665081 IP 192.168.100.11.37020 > 10.20.30.2.6653: Flags [.], ack 1209, win 58, options [nop,nop,TS val 178273 ecr 240941], length 0
15:57:33.576827 IP 192.168.100.11.37020 > 10.20.30.2.6653: Flags [P.], seq 1592:1600, ack 1209, win 58, options [nop,nop,TS val 179501 ecr 240941], length 8: OpenFlow
	version unknown (0x04), type 0x02, length 8, xid 0x00000000
15:57:33.668779 IP 192.168.100.11.37020 > 10.20.30.2.6653: Flags [.], ack 1217, win 58, options [nop,nop,TS val 179524 ecr 242192], length 0
15:57:38.567796 IP 192.168.100.11.37020 > 10.20.30.2.6653: Flags [P.], seq 1600:1608, ack 1217, win 58, options [nop,nop,TS val 180751 ecr 242192], length 8: OpenFlow
	version unknown (0x04), type 0x02, length 8, xid 0x00000000
15:57:38.659906 IP 192.168.100.11.37020 > 10.20.30.2.6653: Flags [.], ack 1225, win 58, options [nop,nop,TS val 180772 ecr 243440], length 0
15:57:43.571108 IP 192.168.100.11.37020 > 10.20.30.2.6653: Flags [P.], seq 1608:1616, ack 1225, win 58, options [nop,nop,TS val 182001 ecr 243440], length 8: OpenFlow
	version unknown (0x04), type 0x02, length 8, xid 0x00000000
15:57:43.661765 IP 192.168.100.11.37020 > 10.20.30.2.6653: Flags [.], ack 1233, win 58, options [nop,nop,TS val 182022 ecr 244691], length 0
15:57:48.570705 IP 192.168.100.11.37020 > 10.20.30.2.6653: Flags [P.], seq 1616:1624, ack 1233, win 58, options [nop,nop,TS val 183251 ecr 244691], length 8: OpenFlow
	version unknown (0x04), type 0x02, length 8, xid 0x00000000
15:57:48.664961 IP 192.168.100.11.37020 > 10.20.30.2.6653: Flags [.], ack 1241, win 58, options [nop,nop,TS val 183273 ecr 245940], length 0
15:57:53.573134 IP 192.168.100.11.37020 > 10.20.30.2.6653: Flags [P.], seq 1624:1632, ack 1241, win 58, options [nop,nop,TS val 184501 ecr 245940], length 8: OpenFlow
	version unknown (0x04), type 0x02, length 8, xid 0x00000000
15:57:53.665651 IP 192.168.100.11.37020 > 10.20.30.2.6653: Flags [.], ack 1249, win 58, options [nop,nop,TS val 184522 ecr 247192], length 0
15:57:58.578292 IP 192.168.100.11.37020 > 10.20.30.2.6653: Flags [P.], seq 1632:1640, ack 1249, win 58, options [nop,nop,TS val 185751 ecr 247192], length 8: OpenFlow
	version unknown (0x04), type 0x02, length 8, xid 0x00000000
15:57:58.670241 IP 192.168.100.11.37020 > 10.20.30.2.6653: Flags [.], ack 1257, win 58, options [nop,nop,TS val 185775 ecr 248442], length 0
15:58:03.570114 IP 192.168.100.11.37020 > 10.20.30.2.6653: Flags [P.], seq 1640:1648, ack 1257, win 58, options [nop,nop,TS val 187001 ecr 248442], length 8: OpenFlow
	version unknown (0x04), type 0x02, length 8, xid 0x00000000
15:58:03.663185 IP 192.168.100.11.37020 > 10.20.30.2.6653: Flags [.], ack 1265, win 58, options [nop,nop,TS val 187024 ecr 249691], length 0
15:58:08.564198 IP 192.168.100.11.37020 > 10.20.30.2.6653: Flags [P.], seq 1648:1656, ack 1265, win 58, options [nop,nop,TS val 188251 ecr 249691], length 8: OpenFlow
	version unknown (0x04), type 0x02, length 8, xid 0x00000000
15:58:08.654930 IP 192.168.100.11.37020 > 10.20.30.2.6653: Flags [.], ack 1273, win 58, options [nop,nop,TS val 188271 ecr 250939], length 0
15:58:13.570429 IP 192.168.100.11.37020 > 10.20.30.2.6653: Flags [P.], seq 1656:1664, ack 1273, win 58, options [nop,nop,TS val 189501 ecr 250939], length 8: OpenFlow
	version unknown (0x04), type 0x02, length 8, xid 0x00000000
15:58:13.677713 IP 192.168.100.11.37020 > 10.20.30.2.6653: Flags [.], ack 1281, win 58, options [nop,nop,TS val 189527 ecr 252190], length 0
15:58:18.573851 IP 192.168.100.11.37020 > 10.20.30.2.6653: Flags [P.], seq 1664:1672, ack 1281, win 58, options [nop,nop,TS val 190751 ecr 252190], length 8: OpenFlow
	version unknown (0x04), type 0x02, length 8, xid 0x00000000
15:58:18.670233 IP 192.168.100.11.37020 > 10.20.30.2.6653: Flags [.], ack 1289, win 58, options [nop,nop,TS val 190774 ecr 253441], length 0
15:58:23.568105 IP 192.168.100.11.37020 > 10.20.30.2.6653: Flags [P.], seq 1672:1680, ack 1289, win 58, options [nop,nop,TS val 192001 ecr 253441], length 8: OpenFlow
	version unknown (0x04), type 0x02, length 8, xid 0x00000000
15:58:23.657904 IP 192.168.100.11.37020 > 10.20.30.2.6653: Flags [.], ack 1297, win 58, options [nop,nop,TS val 192021 ecr 254690], length 0
15:58:28.574541 IP 192.168.100.11.37020 > 10.20.30.2.6653: Flags [P.], seq 1680:1688, ack 1297, win 58, options [nop,nop,TS val 193251 ecr 254690], length 8: OpenFlow
	version unknown (0x04), type 0x02, length 8, xid 0x00000000
15:58:28.667253 IP 192.168.100.11.37020 > 10.20.30.2.6653: Flags [.], ack 1305, win 58, options [nop,nop,TS val 193274 ecr 255941], length 0
15:58:33.579118 IP 192.168.100.11.37020 > 10.20.30.2.6653: Flags [P.], seq 1688:1696, ack 1305, win 58, options [nop,nop,TS val 194501 ecr 255941], length 8: OpenFlow
	version unknown (0x04), type 0x02, length 8, xid 0x00000000
15:58:33.666332 IP 192.168.100.11.37020 > 10.20.30.2.6653: Flags [.], ack 1313, win 58, options [nop,nop,TS val 194524 ecr 257194], length 0
15:58:38.569321 IP 192.168.100.11.37020 > 10.20.30.2.6653: Flags [P.], seq 1696:1704, ack 1313, win 58, options [nop,nop,TS val 195751 ecr 257194], length 8: OpenFlow
	version unknown (0x04), type 0x02, length 8, xid 0x00000000
15:58:38.659188 IP 192.168.100.11.37020 > 10.20.30.2.6653: Flags [.], ack 1321, win 58, options [nop,nop,TS val 195771 ecr 258441], length 0
15:58:43.566270 IP 192.168.100.11.37020 > 10.20.30.2.6653: Flags [P.], seq 1704:1712, ack 1321, win 58, options [nop,nop,TS val 197001 ecr 258441], length 8: OpenFlow
	version unknown (0x04), type 0x02, length 8, xid 0x00000000
15:58:43.658328 IP 192.168.100.11.37020 > 10.20.30.2.6653: Flags [.], ack 1329, win 58, options [nop,nop,TS val 197022 ecr 259689], length 0
15:58:48.568210 IP 192.168.100.11.37020 > 10.20.30.2.6653: Flags [P.], seq 1712:1720, ack 1329, win 58, options [nop,nop,TS val 198251 ecr 259689], length 8: OpenFlow
	version unknown (0x04), type 0x02, length 8, xid 0x00000000
15:58:48.668807 IP 192.168.100.11.37020 > 10.20.30.2.6653: Flags [.], ack 1337, win 58, options [nop,nop,TS val 198272 ecr 260940], length 0
15:58:53.564438 IP 192.168.100.11.37020 > 10.20.30.2.6653: Flags [P.], seq 1720:1728, ack 1337, win 58, options [nop,nop,TS val 199501 ecr 260940], length 8: OpenFlow
	version unknown (0x04), type 0x02, length 8, xid 0x00000000
15:58:53.657981 IP 192.168.100.11.37020 > 10.20.30.2.6653: Flags [.], ack 1345, win 58, options [nop,nop,TS val 199521 ecr 262189], length 0
15:58:58.575438 IP 192.168.100.11.37020 > 10.20.30.2.6653: Flags [P.], seq 1728:1736, ack 1345, win 58, options [nop,nop,TS val 200751 ecr 262189], length 8: OpenFlow
	version unknown (0x04), type 0x02, length 8, xid 0x00000000
15:58:58.663302 IP 192.168.100.11.37020 > 10.20.30.2.6653: Flags [.], ack 1353, win 58, options [nop,nop,TS val 200773 ecr 263442], length 0
15:59:03.575859 IP 192.168.100.11.37020 > 10.20.30.2.6653: Flags [P.], seq 1736:1744, ack 1353, win 58, options [nop,nop,TS val 202002 ecr 263442], length 8: OpenFlow
	version unknown (0x04), type 0x02, length 8, xid 0x00000000
15:59:03.668319 IP 192.168.100.11.37020 > 10.20.30.2.6653: Flags [.], ack 1361, win 58, options [nop,nop,TS val 202024 ecr 264693], length 0
15:59:08.575239 IP 192.168.100.11.37020 > 10.20.30.2.6653: Flags [P.], seq 1744:1752, ack 1361, win 58, options [nop,nop,TS val 203251 ecr 264693], length 8: OpenFlow
	version unknown (0x04), type 0x02, length 8, xid 0x00000000
15:59:08.668768 IP 192.168.100.11.37020 > 10.20.30.2.6653: Flags [.], ack 1369, win 58, options [nop,nop,TS val 203274 ecr 265942], length 0
15:59:13.570841 IP 192.168.100.11.37020 > 10.20.30.2.6653: Flags [P.], seq 1752:1760, ack 1369, win 58, options [nop,nop,TS val 204501 ecr 265942], length 8: OpenFlow
	version unknown (0x04), type 0x02, length 8, xid 0x00000000
15:59:13.661602 IP 192.168.100.11.37020 > 10.20.30.2.6653: Flags [.], ack 1377, win 58, options [nop,nop,TS val 204523 ecr 267191], length 0
15:59:18.570351 IP 192.168.100.11.37020 > 10.20.30.2.6653: Flags [P.], seq 1760:1768, ack 1377, win 58, options [nop,nop,TS val 205751 ecr 267191], length 8: OpenFlow
	version unknown (0x04), type 0x02, length 8, xid 0x00000000
15:59:18.663323 IP 192.168.100.11.37020 > 10.20.30.2.6653: Flags [.], ack 1385, win 58, options [nop,nop,TS val 205773 ecr 268441], length 0
15:59:23.568562 IP 192.168.100.11.37020 > 10.20.30.2.6653: Flags [P.], seq 1768:1776, ack 1385, win 58, options [nop,nop,TS val 207001 ecr 268441], length 8: OpenFlow
	version unknown (0x04), type 0x02, length 8, xid 0x00000000
15:59:23.659471 IP 192.168.100.11.37020 > 10.20.30.2.6653: Flags [.], ack 1393, win 58, options [nop,nop,TS val 207022 ecr 269690], length 0
15:59:28.578300 IP 192.168.100.11.37020 > 10.20.30.2.6653: Flags [P.], seq 1776:1784, ack 1393, win 58, options [nop,nop,TS val 208251 ecr 269690], length 8: OpenFlow
	version unknown (0x04), type 0x02, length 8, xid 0x00000000
15:59:28.667336 IP 192.168.100.11.37020 > 10.20.30.2.6653: Flags [.], ack 1401, win 58, options [nop,nop,TS val 208274 ecr 270944], length 0
15:59:33.568558 IP 192.168.100.11.37020 > 10.20.30.2.6653: Flags [P.], seq 1784:1792, ack 1401, win 58, options [nop,nop,TS val 209501 ecr 270944], length 8: OpenFlow
	version unknown (0x04), type 0x02, length 8, xid 0x00000000
15:59:33.660759 IP 192.168.100.11.37020 > 10.20.30.2.6653: Flags [.], ack 1409, win 58, options [nop,nop,TS val 209522 ecr 272190], length 0
15:59:38.562551 IP 192.168.100.11.37020 > 10.20.30.2.6653: Flags [P.], seq 1792:1800, ack 1409, win 58, options [nop,nop,TS val 210751 ecr 272190], length 8: OpenFlow
	version unknown (0x04), type 0x02, length 8, xid 0x00000000
15:59:38.670904 IP 192.168.100.11.37020 > 10.20.30.2.6653: Flags [.], ack 1417, win 58, options [nop,nop,TS val 210771 ecr 273439], length 0
15:59:43.566376 IP 192.168.100.11.37020 > 10.20.30.2.6653: Flags [P.], seq 1800:1808, ack 1417, win 58, options [nop,nop,TS val 212001 ecr 273439], length 8: OpenFlow
	version unknown (0x04), type 0x02, length 8, xid 0x00000000
15:59:43.659509 IP 192.168.100.11.37020 > 10.20.30.2.6653: Flags [.], ack 1425, win 58, options [nop,nop,TS val 212022 ecr 274689], length 0
15:59:48.686703 IP 192.168.100.11.37020 > 10.20.30.2.6653: Flags [P.], seq 1808:1816, ack 1425, win 58, options [nop,nop,TS val 213267 ecr 274689], length 8: OpenFlow
	version unknown (0x04), type 0x02, length 8, xid 0x00000000
15:59:48.817583 IP 192.168.100.11.37020 > 10.20.30.2.6653: Flags [.], ack 1433, win 58, options [nop,nop,TS val 213307 ecr 275970], length 0
15:59:53.568081 IP 192.168.100.11.37020 > 10.20.30.2.6653: Flags [P.], seq 1816:1824, ack 1433, win 58, options [nop,nop,TS val 214501 ecr 275970], length 8: OpenFlow
	version unknown (0x04), type 0x02, length 8, xid 0x00000000
15:59:53.662985 IP 192.168.100.11.37020 > 10.20.30.2.6653: Flags [.], ack 1441, win 58, options [nop,nop,TS val 214522 ecr 277190], length 0
15:59:58.593949 IP 192.168.100.11.37020 > 10.20.30.2.6653: Flags [P.], seq 1824:1832, ack 1441, win 58, options [nop,nop,TS val 215751 ecr 277190], length 8: OpenFlow
	version unknown (0x04), type 0x02, length 8, xid 0x00000000
15:59:58.687958 IP 192.168.100.11.37020 > 10.20.30.2.6653: Flags [.], ack 1449, win 58, options [nop,nop,TS val 215778 ecr 278447], length 0
16:00:03.588396 IP 192.168.100.11.37020 > 10.20.30.2.6653: Flags [P.], seq 1832:1840, ack 1449, win 58, options [nop,nop,TS val 217001 ecr 278447], length 8: OpenFlow
	version unknown (0x04), type 0x02, length 8, xid 0x00000000
16:00:03.681520 IP 192.168.100.11.37020 > 10.20.30.2.6653: Flags [.], ack 1457, win 58, options [nop,nop,TS val 217027 ecr 279697], length 0
16:00:08.569211 IP 192.168.100.11.37020 > 10.20.30.2.6653: Flags [P.], seq 1840:1848, ack 1457, win 58, options [nop,nop,TS val 218251 ecr 279697], length 8: OpenFlow
	version unknown (0x04), type 0x02, length 8, xid 0x00000000
16:00:08.668112 IP 192.168.100.11.37020 > 10.20.30.2.6653: Flags [.], ack 1465, win 58, options [nop,nop,TS val 218274 ecr 280940], length 0
16:00:13.574906 IP 192.168.100.11.37020 > 10.20.30.2.6653: Flags [P.], seq 1848:1856, ack 1465, win 58, options [nop,nop,TS val 219501 ecr 280940], length 8: OpenFlow
	version unknown (0x04), type 0x02, length 8, xid 0x00000000
16:00:13.669252 IP 192.168.100.11.37020 > 10.20.30.2.6653: Flags [.], ack 1473, win 58, options [nop,nop,TS val 219524 ecr 282192], length 0
16:00:18.574958 IP 192.168.100.11.37020 > 10.20.30.2.6653: Flags [P.], seq 1856:1864, ack 1473, win 58, options [nop,nop,TS val 220751 ecr 282192], length 8: OpenFlow
	version unknown (0x04), type 0x02, length 8, xid 0x00000000
16:00:18.669510 IP 192.168.100.11.37020 > 10.20.30.2.6653: Flags [.], ack 1481, win 58, options [nop,nop,TS val 220774 ecr 283442], length 0
16:00:23.569944 IP 192.168.100.11.37020 > 10.20.30.2.6653: Flags [P.], seq 1864:1872, ack 1481, win 58, options [nop,nop,TS val 222001 ecr 283442], length 8: OpenFlow
	version unknown (0x04), type 0x02, length 8, xid 0x00000000
16:00:23.661561 IP 192.168.100.11.37020 > 10.20.30.2.6653: Flags [.], ack 1489, win 58, options [nop,nop,TS val 222022 ecr 284690], length 0
16:00:28.593259 IP 192.168.100.11.37020 > 10.20.30.2.6653: Flags [P.], seq 1872:1880, ack 1489, win 58, options [nop,nop,TS val 223251 ecr 284690], length 8: OpenFlow
	version unknown (0x04), type 0x02, length 8, xid 0x00000000
16:00:28.677432 IP 192.168.100.11.37020 > 10.20.30.2.6653: Flags [.], ack 1497, win 58, options [nop,nop,TS val 223276 ecr 285946], length 0
16:00:33.562787 IP 192.168.100.11.37020 > 10.20.30.2.6653: Flags [P.], seq 1880:1888, ack 1497, win 58, options [nop,nop,TS val 224501 ecr 285946], length 8: OpenFlow
	version unknown (0x04), type 0x02, length 8, xid 0x00000000
16:00:33.658854 IP 192.168.100.11.37020 > 10.20.30.2.6653: Flags [.], ack 1505, win 58, options [nop,nop,TS val 224521 ecr 287188], length 0
16:00:38.574491 IP 192.168.100.11.37020 > 10.20.30.2.6653: Flags [P.], seq 1888:1896, ack 1505, win 58, options [nop,nop,TS val 225751 ecr 287188], length 8: OpenFlow
	version unknown (0x04), type 0x02, length 8, xid 0x00000000
16:00:38.665054 IP 192.168.100.11.37020 > 10.20.30.2.6653: Flags [.], ack 1513, win 58, options [nop,nop,TS val 225773 ecr 288441], length 0
16:00:43.579623 IP 192.168.100.11.37020 > 10.20.30.2.6653: Flags [P.], seq 1896:1904, ack 1513, win 58, options [nop,nop,TS val 227001 ecr 288441], length 8: OpenFlow
	version unknown (0x04), type 0x02, length 8, xid 0x00000000
16:00:43.670929 IP 192.168.100.11.37020 > 10.20.30.2.6653: Flags [.], ack 1521, win 58, options [nop,nop,TS val 227024 ecr 289693], length 0
16:00:43.902953 IP 192.168.100.11.37020 > 10.20.30.2.6653: Flags [P.], seq 1904:1984, ack 1521, win 58, options [nop,nop,TS val 227083 ecr 289693], length 80: OpenFlow
	version unknown (0x04), type 0x0c, length 80, xid 0x00000000
16:00:43.918478 IP 192.168.100.11.37020 > 10.20.30.2.6653: Flags [P.], seq 1984:2064, ack 1521, win 58, options [nop,nop,TS val 227083 ecr 289693], length 80: OpenFlow
	version unknown (0x04), type 0x0c, length 80, xid 0x00000000
16:00:43.933153 IP 192.168.100.11.37020 > 10.20.30.2.6653: Flags [F.], seq 2064, ack 1521, win 58, options [nop,nop,TS val 227083 ecr 289693], length 0
16:00:44.025655 IP 192.168.100.11.37020 > 10.20.30.2.6653: Flags [.], ack 1522, win 58, options [nop,nop,TS val 227113 ecr 289781], length 0
16:00:50.752933 IP 192.168.100.11.37040 > 10.20.30.2.6653: Flags [S], seq 3109700481, win 29200, options [mss 1460,sackOK,TS val 228797 ecr 0,nop,wscale 9], length 0
16:00:50.844612 IP 192.168.100.11.37040 > 10.20.30.2.6653: Flags [.], ack 132892751, win 58, options [nop,nop,TS val 228818 ecr 291486], length 0
16:00:50.861251 IP 192.168.100.11.37040 > 10.20.30.2.6653: Flags [P.], seq 0:16, ack 1, win 58, options [nop,nop,TS val 228818 ecr 291486], length 16: OpenFlow
	version unknown (0x04), type 0x00, length 16, xid 0x00000011
16:00:50.938438 IP 192.168.100.11.37040 > 10.20.30.2.6653: Flags [.], ack 9, win 58, options [nop,nop,TS val 228841 ecr 291509], length 0
16:00:50.969016 IP 192.168.100.11.37040 > 10.20.30.2.6653: Flags [.], ack 17, win 58, options [nop,nop,TS val 228850 ecr 291513], length 0
16:00:50.999660 IP 192.168.100.11.37040 > 10.20.30.2.6653: Flags [P.], seq 16:48, ack 17, win 58, options [nop,nop,TS val 228851 ecr 291513], length 32: OpenFlow
	version unknown (0x04), type 0x06, length 32, xid 0x545562b7
16:00:51.106467 IP 192.168.100.11.37040 > 10.20.30.2.6653: Flags [P.], seq 48:256, ack 33, win 58, options [nop,nop,TS val 228884 ecr 291551], length 208: OpenFlow
	version unknown (0x04), type 0x13, length 208, xid 0x545562b8
16:00:51.181554 IP 192.168.100.11.37040 > 10.20.30.2.6653: Flags [.], ack 113, win 58, options [nop,nop,TS val 228899 ecr 291551], length 0
16:00:55.654425 IP 192.168.100.11.37040 > 10.20.30.2.6653: Flags [P.], seq 256:264, ack 113, win 58, options [nop,nop,TS val 230001 ecr 291584], length 8: OpenFlow
	version unknown (0x04), type 0x02, length 8, xid 0x00000000
16:00:55.794258 IP 192.168.100.11.37040 > 10.20.30.2.6653: Flags [.], ack 121, win 58, options [nop,nop,TS val 230051 ecr 292715], length 0
16:01:00.574546 IP 192.168.100.11.37040 > 10.20.30.2.6653: Flags [P.], seq 264:272, ack 121, win 58, options [nop,nop,TS val 231251 ecr 292715], length 8: OpenFlow
	version unknown (0x04), type 0x02, length 8, xid 0x00000000
16:01:00.667430 IP 192.168.100.11.37040 > 10.20.30.2.6653: Flags [.], ack 129, win 58, options [nop,nop,TS val 231274 ecr 293941], length 0
