[sudo] password for sdn: 
tcpdump: verbose output suppressed, use -v or -vv for full protocol decode
listening on any, link-type LINUX_SLL (Linux cooked), capture size 262144 bytes
15:44:45.566859 IP 192.168.100.11.36980 > 10.20.30.2.6653: Flags [S], seq 606496951, win 29200, options [mss 1460,sackOK,TS val 4294954797 ecr 0,nop,wscale 7], length 0
15:44:53.566318 IP 192.168.100.11.36982 > 10.20.30.2.6653: Flags [S], seq 4031048083, win 29200, options [mss 1460,sackOK,TS val 4294956797 ecr 0,nop,wscale 7], length 0
15:45:01.384778 IP 192.168.100.11.37000 > 10.20.30.2.6653: Flags [S], seq 1813325035, win 29200, options [mss 1460,sackOK,TS val 4294958750 ecr 0,nop,wscale 9], length 0
15:45:01.571171 IP 192.168.100.11.37002 > 10.20.30.2.6653: Flags [S], seq 1845247404, win 29200, options [mss 1460,sackOK,TS val 4294958797 ecr 0,nop,wscale 9], length 0
15:45:03.576363 IP 192.168.100.11.37004 > 10.20.30.2.6653: Flags [S], seq 932691714, win 29200, options [mss 1460,sackOK,TS val 4294959297 ecr 0,nop,wscale 9], length 0
15:45:07.565834 IP 192.168.100.11.37006 > 10.20.30.2.6653: Flags [S], seq 3200115855, win 29200, options [mss 1460,sackOK,TS val 4294960297 ecr 0,nop,wscale 9], length 0
15:45:15.573142 IP 192.168.100.11.37008 > 10.20.30.2.6653: Flags [S], seq 414319713, win 29200, options [mss 1460,sackOK,TS val 4294962297 ecr 0,nop,wscale 9], length 0
15:45:23.576655 IP 192.168.100.11.37010 > 10.20.30.2.6653: Flags [S], seq 3571804156, win 29200, options [mss 1460,sackOK,TS val 4294964298 ecr 0,nop,wscale 9], length 0
15:45:31.574369 IP 192.168.100.11.37012 > 10.20.30.2.6653: Flags [S], seq 3909469311, win 29200, options [mss 1460,sackOK,TS val 4294966297 ecr 0,nop,wscale 9], length 0
15:45:39.573600 IP 192.168.100.11.37014 > 10.20.30.2.6653: Flags [S], seq 3415104981, win 29200, options [mss 1460,sackOK,TS val 1001 ecr 0,nop,wscale 9], length 0
15:45:47.568909 IP 192.168.100.11.37016 > 10.20.30.2.6653: Flags [S], seq 1714851486, win 29200, options [mss 1460,sackOK,TS val 3001 ecr 0,nop,wscale 9], length 0
15:45:55.599405 IP 192.168.100.11.37018 > 10.20.30.2.6653: Flags [S], seq 2370236287, win 29200, options [mss 1460,sackOK,TS val 5004 ecr 0,nop,wscale 9], length 0
15:46:03.577597 IP 192.168.100.11.37020 > 10.20.30.2.6653: Flags [S], seq 728398209, win 29200, options [mss 1460,sackOK,TS val 7002 ecr 0,nop,wscale 9], length 0
15:46:03.669832 IP 192.168.100.11.37020 > 10.20.30.2.6653: Flags [.], ack 1136580660, win 58, options [nop,nop,TS val 7024 ecr 69692], length 0
15:46:03.693016 IP 192.168.100.11.37020 > 10.20.30.2.6653: Flags [P.], seq 0:16, ack 1, win 58, options [nop,nop,TS val 7024 ecr 69692], length 16: OpenFlow
	version unknown (0x04), type 0x00, length 16, xid 0x00000008
15:46:03.758891 IP 192.168.100.11.37020 > 10.20.30.2.6653: Flags [.], ack 9, win 58, options [nop,nop,TS val 7047 ecr 69718], length 0
15:46:03.789130 IP 192.168.100.11.37020 > 10.20.30.2.6653: Flags [.], ack 17, win 58, options [nop,nop,TS val 7054 ecr 69723], length 0
15:46:03.821129 IP 192.168.100.11.37020 > 10.20.30.2.6653: Flags [P.], seq 16:48, ack 17, win 58, options [nop,nop,TS val 7054 ecr 69723], length 32: OpenFlow
	version unknown (0x04), type 0x06, length 32, xid 0xf50b35a8
15:46:03.913013 IP 192.168.100.11.37020 > 10.20.30.2.6653: Flags [P.], seq 48:256, ack 33, win 58, options [nop,nop,TS val 7086 ecr 69755], length 208: OpenFlow
	version unknown (0x04), type 0x13, length 208, xid 0xf50b35a9
15:46:03.960034 IP 192.168.100.11.37020 > 10.20.30.2.6653: Flags [.], ack 113, win 58, options [nop,nop,TS val 7100 ecr 69755], length 0
15:46:08.566444 IP 192.168.100.11.37020 > 10.20.30.2.6653: Flags [P.], seq 256:264, ack 113, win 58, options [nop,nop,TS val 8251 ecr 69786], length 8: OpenFlow
	version unknown (0x04), type 0x02, length 8, xid 0x00000000
15:46:08.672644 IP 192.168.100.11.37020 > 10.20.30.2.6653: Flags [.], ack 121, win 58, options [nop,nop,TS val 8275 ecr 70940], length 0
15:46:13.584889 IP 192.168.100.11.37020 > 10.20.30.2.6653: Flags [P.], seq 264:272, ack 121, win 58, options [nop,nop,TS val 9501 ecr 70940], length 8: OpenFlow
	version unknown (0x04), type 0x02, length 8, xid 0x00000000
15:46:13.671237 IP 192.168.100.11.37020 > 10.20.30.2.6653: Flags [.], ack 129, win 58, options [nop,nop,TS val 9524 ecr 72194], length 0
15:46:18.586444 IP 192.168.100.11.37020 > 10.20.30.2.6653: Flags [P.], seq 272:280, ack 129, win 58, options [nop,nop,TS val 10753 ecr 72194], length 8: OpenFlow
	version unknown (0x04), type 0x02, length 8, xid 0x00000000
15:46:18.680508 IP 192.168.100.11.37020 > 10.20.30.2.6653: Flags [.], ack 137, win 58, options [nop,nop,TS val 10776 ecr 73445], length 0
15:46:23.608476 IP 192.168.100.11.37020 > 10.20.30.2.6653: Flags [P.], seq 280:288, ack 137, win 58, options [nop,nop,TS val 12001 ecr 73445], length 8: OpenFlow
	version unknown (0x04), type 0x02, length 8, xid 0x00000000
15:46:23.699610 IP 192.168.100.11.37020 > 10.20.30.2.6653: Flags [.], ack 145, win 58, options [nop,nop,TS val 12031 ecr 74700], length 0
15:46:28.569920 IP 192.168.100.11.37020 > 10.20.30.2.6653: Flags [P.], seq 288:296, ack 145, win 58, options [nop,nop,TS val 13251 ecr 74700], length 8: OpenFlow
	version unknown (0x04), type 0x02, length 8, xid 0x00000000
15:46:28.663592 IP 192.168.100.11.37020 > 10.20.30.2.6653: Flags [.], ack 153, win 58, options [nop,nop,TS val 13272 ecr 75940], length 0
