[sudo] password for sdn: 
tcpdump: verbose output suppressed, use -v or -vv for full protocol decode
listening on any, link-type LINUX_SLL (Linux cooked), capture size 262144 bytes
09:57:10.101316 IP 192.168.100.11.52298 > 10.20.30.2.6653: Flags [P.], seq 3922891317:3922891325, ack 1033115940, win 229, options [nop,nop,TS val 89251 ecr 99721], length 8: OpenFlow
	version unknown (0x04), type 0x02, length 8, xid 0x00000000
09:57:10.193726 IP 192.168.100.11.52298 > 10.20.30.2.6653: Flags [.], ack 9, win 229, options [nop,nop,TS val 89271 ecr 100969], length 0
09:57:15.112927 IP 192.168.100.11.52298 > 10.20.30.2.6653: Flags [P.], seq 8:16, ack 9, win 229, options [nop,nop,TS val 90501 ecr 100969], length 8: OpenFlow
	version unknown (0x04), type 0x02, length 8, xid 0x00000000
09:57:15.206990 IP 192.168.100.11.52298 > 10.20.30.2.6653: Flags [.], ack 17, win 229, options [nop,nop,TS val 90524 ecr 102222], length 0
09:57:20.101802 IP 192.168.100.11.52298 > 10.20.30.2.6653: Flags [P.], seq 16:24, ack 17, win 229, options [nop,nop,TS val 91751 ecr 102222], length 8: OpenFlow
	version unknown (0x04), type 0x02, length 8, xid 0x00000000
09:57:20.193665 IP 192.168.100.11.52298 > 10.20.30.2.6653: Flags [.], ack 25, win 229, options [nop,nop,TS val 91771 ecr 103469], length 0
09:57:25.114711 IP 192.168.100.11.52298 > 10.20.30.2.6653: Flags [P.], seq 24:32, ack 25, win 229, options [nop,nop,TS val 93001 ecr 103469], length 8: OpenFlow
	version unknown (0x04), type 0x02, length 8, xid 0x00000000
09:57:25.206253 IP 192.168.100.11.52298 > 10.20.30.2.6653: Flags [.], ack 33, win 229, options [nop,nop,TS val 93024 ecr 104722], length 0
09:57:25.545641 IP 192.168.100.11.52298 > 10.20.30.2.6653: Flags [P.], seq 32:112, ack 33, win 229, options [nop,nop,TS val 93110 ecr 104722], length 80: OpenFlow
	version unknown (0x04), type 0x0c, length 80, xid 0x00000000
09:57:25.560713 IP 192.168.100.11.52298 > 10.20.30.2.6653: Flags [P.], seq 112:192, ack 33, win 229, options [nop,nop,TS val 93110 ecr 104722], length 80: OpenFlow
	version unknown (0x04), type 0x0c, length 80, xid 0x00000000
09:57:25.575697 IP 192.168.100.11.52298 > 10.20.30.2.6653: Flags [F.], seq 192, ack 33, win 229, options [nop,nop,TS val 93110 ecr 104722], length 0
09:57:25.669302 IP 192.168.100.11.52298 > 10.20.30.2.6653: Flags [.], ack 34, win 229, options [nop,nop,TS val 93140 ecr 104837], length 0
09:57:31.641590 IP 192.168.100.11.52316 > 10.20.30.2.6653: Flags [S], seq 683932962, win 29200, options [mss 1460,sackOK,TS val 94636 ecr 0,nop,wscale 9], length 0
09:57:31.734473 IP 192.168.100.11.52316 > 10.20.30.2.6653: Flags [.], ack 114295622, win 58, options [nop,nop,TS val 94656 ecr 106353], length 0
09:57:31.750334 IP 192.168.100.11.52316 > 10.20.30.2.6653: Flags [P.], seq 0:16, ack 1, win 58, options [nop,nop,TS val 94656 ecr 106353], length 16: OpenFlow
	version unknown (0x04), type 0x00, length 16, xid 0x00000009
09:57:31.826538 IP 192.168.100.11.52316 > 10.20.30.2.6653: Flags [.], ack 9, win 58, options [nop,nop,TS val 94679 ecr 106377], length 0
09:57:31.858279 IP 192.168.100.11.52316 > 10.20.30.2.6653: Flags [.], ack 17, win 58, options [nop,nop,TS val 94687 ecr 106381], length 0
09:57:31.890111 IP 192.168.100.11.52316 > 10.20.30.2.6653: Flags [P.], seq 16:48, ack 17, win 58, options [nop,nop,TS val 94687 ecr 106381], length 32: OpenFlow
	version unknown (0x04), type 0x06, length 32, xid 0x92db2335
09:57:31.997160 IP 192.168.100.11.52316 > 10.20.30.2.6653: Flags [P.], seq 48:256, ack 33, win 58, options [nop,nop,TS val 94722 ecr 106419], length 208: OpenFlow
	version unknown (0x04), type 0x13, length 208, xid 0x92db2336
09:57:32.043226 IP 192.168.100.11.52316 > 10.20.30.2.6653: Flags [.], ack 113, win 58, options [nop,nop,TS val 94737 ecr 106419], length 0
09:57:36.098665 IP 192.168.100.11.52316 > 10.20.30.2.6653: Flags [P.], seq 256:264, ack 113, win 58, options [nop,nop,TS val 95751 ecr 106452], length 8: OpenFlow
	version unknown (0x04), type 0x02, length 8, xid 0x00000000
09:57:36.206213 IP 192.168.100.11.52316 > 10.20.30.2.6653: Flags [.], ack 121, win 58, options [nop,nop,TS val 95775 ecr 107468], length 0
09:57:41.113718 IP 192.168.100.11.52316 > 10.20.30.2.6653: Flags [P.], seq 264:272, ack 121, win 58, options [nop,nop,TS val 97001 ecr 107468], length 8: OpenFlow
	version unknown (0x04), type 0x02, length 8, xid 0x00000000
09:57:41.206989 IP 192.168.100.11.52316 > 10.20.30.2.6653: Flags [.], ack 129, win 58, options [nop,nop,TS val 97024 ecr 108721], length 0
09:57:46.101287 IP 192.168.100.11.52316 > 10.20.30.2.6653: Flags [P.], seq 272:280, ack 129, win 58, options [nop,nop,TS val 98251 ecr 108721], length 8: OpenFlow
	version unknown (0x04), type 0x02, length 8, xid 0x00000000
09:57:46.191483 IP 192.168.100.11.52316 > 10.20.30.2.6653: Flags [.], ack 137, win 58, options [nop,nop,TS val 98271 ecr 109969], length 0
09:57:51.112836 IP 192.168.100.11.52316 > 10.20.30.2.6653: Flags [P.], seq 280:288, ack 137, win 58, options [nop,nop,TS val 99501 ecr 109969], length 8: OpenFlow
	version unknown (0x04), type 0x02, length 8, xid 0x00000000
09:57:51.207079 IP 192.168.100.11.52316 > 10.20.30.2.6653: Flags [.], ack 145, win 58, options [nop,nop,TS val 99524 ecr 111221], length 0
09:57:56.107872 IP 192.168.100.11.52316 > 10.20.30.2.6653: Flags [P.], seq 288:296, ack 145, win 58, options [nop,nop,TS val 100751 ecr 111221], length 8: OpenFlow
	version unknown (0x04), type 0x02, length 8, xid 0x00000000
09:57:56.200284 IP 192.168.100.11.52316 > 10.20.30.2.6653: Flags [.], ack 153, win 58, options [nop,nop,TS val 100773 ecr 112470], length 0
09:58:01.114983 IP 192.168.100.11.52316 > 10.20.30.2.6653: Flags [P.], seq 296:304, ack 153, win 58, options [nop,nop,TS val 102001 ecr 112470], length 8: OpenFlow
	version unknown (0x04), type 0x02, length 8, xid 0x00000000
09:58:01.207049 IP 192.168.100.11.52316 > 10.20.30.2.6653: Flags [.], ack 161, win 58, options [nop,nop,TS val 102025 ecr 113722], length 0
09:58:06.106208 IP 192.168.100.11.52316 > 10.20.30.2.6653: Flags [P.], seq 304:312, ack 161, win 58, options [nop,nop,TS val 103251 ecr 113722], length 8: OpenFlow
	version unknown (0x04), type 0x02, length 8, xid 0x00000000
09:58:06.200192 IP 192.168.100.11.52316 > 10.20.30.2.6653: Flags [.], ack 169, win 58, options [nop,nop,TS val 103273 ecr 114969], length 0
09:58:11.107841 IP 192.168.100.11.52316 > 10.20.30.2.6653: Flags [P.], seq 312:320, ack 169, win 58, options [nop,nop,TS val 104501 ecr 114969], length 8: OpenFlow
	version unknown (0x04), type 0x02, length 8, xid 0x00000000
09:58:11.200697 IP 192.168.100.11.52316 > 10.20.30.2.6653: Flags [.], ack 177, win 58, options [nop,nop,TS val 104523 ecr 116220], length 0
09:58:16.113354 IP 192.168.100.11.52316 > 10.20.30.2.6653: Flags [P.], seq 320:328, ack 177, win 58, options [nop,nop,TS val 105751 ecr 116220], length 8: OpenFlow
	version unknown (0x04), type 0x02, length 8, xid 0x00000000
09:58:16.206685 IP 192.168.100.11.52316 > 10.20.30.2.6653: Flags [.], ack 185, win 58, options [nop,nop,TS val 105774 ecr 117471], length 0
09:58:21.112507 IP 192.168.100.11.52316 > 10.20.30.2.6653: Flags [P.], seq 328:336, ack 185, win 58, options [nop,nop,TS val 107001 ecr 117471], length 8: OpenFlow
	version unknown (0x04), type 0x02, length 8, xid 0x00000000
09:58:21.207525 IP 192.168.100.11.52316 > 10.20.30.2.6653: Flags [.], ack 193, win 58, options [nop,nop,TS val 107025 ecr 118721], length 0
09:58:26.109122 IP 192.168.100.11.52316 > 10.20.30.2.6653: Flags [P.], seq 336:344, ack 193, win 58, options [nop,nop,TS val 108251 ecr 118721], length 8: OpenFlow
	version unknown (0x04), type 0x02, length 8, xid 0x00000000
09:58:26.200730 IP 192.168.100.11.52316 > 10.20.30.2.6653: Flags [.], ack 201, win 58, options [nop,nop,TS val 108273 ecr 119970], length 0
09:58:31.099601 IP 192.168.100.11.52316 > 10.20.30.2.6653: Flags [P.], seq 344:352, ack 201, win 58, options [nop,nop,TS val 109501 ecr 119970], length 8: OpenFlow
	version unknown (0x04), type 0x02, length 8, xid 0x00000000
09:58:31.193594 IP 192.168.100.11.52316 > 10.20.30.2.6653: Flags [.], ack 209, win 58, options [nop,nop,TS val 109521 ecr 121218], length 0
09:58:36.112805 IP 192.168.100.11.52316 > 10.20.30.2.6653: Flags [P.], seq 352:360, ack 209, win 58, options [nop,nop,TS val 110751 ecr 121218], length 8: OpenFlow
	version unknown (0x04), type 0x02, length 8, xid 0x00000000
09:58:36.204047 IP 192.168.100.11.52316 > 10.20.30.2.6653: Flags [.], ack 217, win 58, options [nop,nop,TS val 110774 ecr 122471], length 0
09:58:41.111721 IP 192.168.100.11.52316 > 10.20.30.2.6653: Flags [P.], seq 360:368, ack 217, win 58, options [nop,nop,TS val 112001 ecr 122471], length 8: OpenFlow
	version unknown (0x04), type 0x02, length 8, xid 0x00000000
09:58:41.204139 IP 192.168.100.11.52316 > 10.20.30.2.6653: Flags [.], ack 225, win 58, options [nop,nop,TS val 112024 ecr 123721], length 0
09:58:46.112624 IP 192.168.100.11.52316 > 10.20.30.2.6653: Flags [P.], seq 368:376, ack 225, win 58, options [nop,nop,TS val 113251 ecr 123721], length 8: OpenFlow
	version unknown (0x04), type 0x02, length 8, xid 0x00000000
09:58:46.204349 IP 192.168.100.11.52316 > 10.20.30.2.6653: Flags [.], ack 233, win 58, options [nop,nop,TS val 113274 ecr 124971], length 0
09:58:51.108487 IP 192.168.100.11.52316 > 10.20.30.2.6653: Flags [P.], seq 376:384, ack 233, win 58, options [nop,nop,TS val 114501 ecr 124971], length 8: OpenFlow
	version unknown (0x04), type 0x02, length 8, xid 0x00000000
09:58:51.203107 IP 192.168.100.11.52316 > 10.20.30.2.6653: Flags [.], ack 241, win 58, options [nop,nop,TS val 114523 ecr 126220], length 0
09:58:56.099960 IP 192.168.100.11.52316 > 10.20.30.2.6653: Flags [P.], seq 384:392, ack 241, win 58, options [nop,nop,TS val 115751 ecr 126220], length 8: OpenFlow
	version unknown (0x04), type 0x02, length 8, xid 0x00000000
09:58:56.193561 IP 192.168.100.11.52316 > 10.20.30.2.6653: Flags [.], ack 249, win 58, options [nop,nop,TS val 115771 ecr 127468], length 0
09:59:01.114893 IP 192.168.100.11.52316 > 10.20.30.2.6653: Flags [P.], seq 392:400, ack 249, win 58, options [nop,nop,TS val 117001 ecr 127468], length 8: OpenFlow
	version unknown (0x04), type 0x02, length 8, xid 0x00000000
09:59:01.208731 IP 192.168.100.11.52316 > 10.20.30.2.6653: Flags [.], ack 257, win 58, options [nop,nop,TS val 117025 ecr 128722], length 0
09:59:06.101506 IP 192.168.100.11.52316 > 10.20.30.2.6653: Flags [P.], seq 400:408, ack 257, win 58, options [nop,nop,TS val 118251 ecr 128722], length 8: OpenFlow
	version unknown (0x04), type 0x02, length 8, xid 0x00000000
09:59:06.194658 IP 192.168.100.11.52316 > 10.20.30.2.6653: Flags [.], ack 265, win 58, options [nop,nop,TS val 118272 ecr 129969], length 0
09:59:11.113547 IP 192.168.100.11.52316 > 10.20.30.2.6653: Flags [P.], seq 408:416, ack 265, win 58, options [nop,nop,TS val 119501 ecr 129969], length 8: OpenFlow
	version unknown (0x04), type 0x02, length 8, xid 0x00000000
09:59:11.207459 IP 192.168.100.11.52316 > 10.20.30.2.6653: Flags [.], ack 273, win 58, options [nop,nop,TS val 119524 ecr 131221], length 0
09:59:16.103675 IP 192.168.100.11.52316 > 10.20.30.2.6653: Flags [P.], seq 416:424, ack 273, win 58, options [nop,nop,TS val 120751 ecr 131221], length 8: OpenFlow
	version unknown (0x04), type 0x02, length 8, xid 0x00000000
09:59:16.195283 IP 192.168.100.11.52316 > 10.20.30.2.6653: Flags [.], ack 281, win 58, options [nop,nop,TS val 120772 ecr 132469], length 0
09:59:21.102722 IP 192.168.100.11.52316 > 10.20.30.2.6653: Flags [P.], seq 424:432, ack 281, win 58, options [nop,nop,TS val 122001 ecr 132469], length 8: OpenFlow
	version unknown (0x04), type 0x02, length 8, xid 0x00000000
09:59:21.195460 IP 192.168.100.11.52316 > 10.20.30.2.6653: Flags [.], ack 289, win 58, options [nop,nop,TS val 122022 ecr 133719], length 0
09:59:26.111136 IP 192.168.100.11.52316 > 10.20.30.2.6653: Flags [P.], seq 432:440, ack 289, win 58, options [nop,nop,TS val 123251 ecr 133719], length 8: OpenFlow
	version unknown (0x04), type 0x02, length 8, xid 0x00000000
09:59:26.203915 IP 192.168.100.11.52316 > 10.20.30.2.6653: Flags [.], ack 297, win 58, options [nop,nop,TS val 123273 ecr 134971], length 0
09:59:31.101499 IP 192.168.100.11.52316 > 10.20.30.2.6653: Flags [P.], seq 440:448, ack 297, win 58, options [nop,nop,TS val 124501 ecr 134971], length 8: OpenFlow
	version unknown (0x04), type 0x02, length 8, xid 0x00000000
09:59:31.196167 IP 192.168.100.11.52316 > 10.20.30.2.6653: Flags [.], ack 305, win 58, options [nop,nop,TS val 124521 ecr 136218], length 0
09:59:36.108345 IP 192.168.100.11.52316 > 10.20.30.2.6653: Flags [P.], seq 448:456, ack 305, win 58, options [nop,nop,TS val 125751 ecr 136218], length 8: OpenFlow
	version unknown (0x04), type 0x02, length 8, xid 0x00000000
09:59:36.203112 IP 192.168.100.11.52316 > 10.20.30.2.6653: Flags [.], ack 313, win 58, options [nop,nop,TS val 125773 ecr 137470], length 0
09:59:41.104749 IP 192.168.100.11.52316 > 10.20.30.2.6653: Flags [P.], seq 456:464, ack 313, win 58, options [nop,nop,TS val 127001 ecr 137470], length 8: OpenFlow
	version unknown (0x04), type 0x02, length 8, xid 0x00000000
09:59:41.200332 IP 192.168.100.11.52316 > 10.20.30.2.6653: Flags [.], ack 321, win 58, options [nop,nop,TS val 127022 ecr 138719], length 0
09:59:46.105719 IP 192.168.100.11.52316 > 10.20.30.2.6653: Flags [P.], seq 464:472, ack 321, win 58, options [nop,nop,TS val 128251 ecr 138719], length 8: OpenFlow
	version unknown (0x04), type 0x02, length 8, xid 0x00000000
09:59:46.197299 IP 192.168.100.11.52316 > 10.20.30.2.6653: Flags [.], ack 329, win 58, options [nop,nop,TS val 128272 ecr 139970], length 0
09:59:51.112403 IP 192.168.100.11.52316 > 10.20.30.2.6653: Flags [P.], seq 472:480, ack 329, win 58, options [nop,nop,TS val 129501 ecr 139970], length 8: OpenFlow
	version unknown (0x04), type 0x02, length 8, xid 0x00000000
09:59:51.205361 IP 192.168.100.11.52316 > 10.20.30.2.6653: Flags [.], ack 337, win 58, options [nop,nop,TS val 129524 ecr 141221], length 0
09:59:56.106732 IP 192.168.100.11.52316 > 10.20.30.2.6653: Flags [P.], seq 480:488, ack 337, win 58, options [nop,nop,TS val 130751 ecr 141221], length 8: OpenFlow
	version unknown (0x04), type 0x02, length 8, xid 0x00000000
09:59:56.200753 IP 192.168.100.11.52316 > 10.20.30.2.6653: Flags [.], ack 345, win 58, options [nop,nop,TS val 130773 ecr 142470], length 0
10:00:01.114313 IP 192.168.100.11.52316 > 10.20.30.2.6653: Flags [P.], seq 488:496, ack 345, win 58, options [nop,nop,TS val 132001 ecr 142470], length 8: OpenFlow
	version unknown (0x04), type 0x02, length 8, xid 0x00000000
10:00:01.203931 IP 192.168.100.11.52316 > 10.20.30.2.6653: Flags [.], ack 353, win 58, options [nop,nop,TS val 132024 ecr 143722], length 0
10:00:06.107201 IP 192.168.100.11.52316 > 10.20.30.2.6653: Flags [P.], seq 496:504, ack 353, win 58, options [nop,nop,TS val 133251 ecr 143722], length 8: OpenFlow
	version unknown (0x04), type 0x02, length 8, xid 0x00000000
10:00:06.197494 IP 192.168.100.11.52316 > 10.20.30.2.6653: Flags [.], ack 361, win 58, options [nop,nop,TS val 133272 ecr 144970], length 0
10:00:11.104424 IP 192.168.100.11.52316 > 10.20.30.2.6653: Flags [P.], seq 504:512, ack 361, win 58, options [nop,nop,TS val 134501 ecr 144970], length 8: OpenFlow
	version unknown (0x04), type 0x02, length 8, xid 0x00000000
10:00:11.196731 IP 192.168.100.11.52316 > 10.20.30.2.6653: Flags [.], ack 369, win 58, options [nop,nop,TS val 134522 ecr 146219], length 0
10:00:16.104680 IP 192.168.100.11.52316 > 10.20.30.2.6653: Flags [P.], seq 512:520, ack 369, win 58, options [nop,nop,TS val 135751 ecr 146219], length 8: OpenFlow
	version unknown (0x04), type 0x02, length 8, xid 0x00000000
10:00:16.197321 IP 192.168.100.11.52316 > 10.20.30.2.6653: Flags [.], ack 377, win 58, options [nop,nop,TS val 135772 ecr 147469], length 0
^C
86 packets captured
87 packets received by filter
0 packets dropped by kernel
